id,word,meaning,day,week_start,date_sent
230,gaiety,"the state or quality of being cheerful, lively, and full of high spirits.",wednesday,2026-02-02,2026-02-04
231,delirium,"a disturbed state of mind marked by confusion, disordered speech, and hallucinations, often due to illness or intoxication.",thursday,2026-02-02,2026-02-05
232,giddiness,"a sensation of lightheadedness, dizziness, or excitement; feeling silly or overly happy.",thursday,2026-02-02,2026-02-05
233,impetuosity,the quality of acting quickly and without thought or care for the consequences; impulsiveness.,thursday,2026-02-02,2026-02-05
234,pyrrhic,referring to a victory that is so costly it is almost tantamount to defeat.,thursday,2026-02-02,2026-02-05
235,explicate,to explain or analyze something in detail; to make clear.,thursday,2026-02-02,2026-02-05
236,malevolence,the state or condition of wishing to do evil or cause harm to others.,thursday,2026-02-02,2026-02-05
237,respite,a short period of rest or relief from something difficult or unpleasant.,thursday,2026-02-02,2026-02-05
238,impugn,to call into question; to challenge or attack as false or questionable.,thursday,2026-02-02,2026-02-05
239,salvage,to rescue or recover something from loss or destruction; to save a situation from failure.,thursday,2026-02-02,2026-02-05
240,posterity,all future generations of people.,thursday,2026-02-02,2026-02-05
241,insidious,"proceeding in a gradual, subtle way but with harmful effects.",friday,2026-02-02,2026-02-06
242,denounce,to publicly criticize or condemn someone or something strongly.,friday,2026-02-02,2026-02-06
243,visceral,relating to deep inward feelings rather than to the intellect; instinctive and emotional.,friday,2026-02-02,2026-02-06
244,courting,"to risk incurring something undesirable, often by one's own actions or behavior.",friday,2026-02-02,2026-02-06
245,decrepit,"worn out, weakened, or ruined from age or neglect.",friday,2026-02-02,2026-02-06
246,incapacitated,deprived of strength or ability; unable to function or act normally.,friday,2026-02-02,2026-02-06
247,languish,"to lose or lack vitality; to grow weak or feeble, often due to neglect or hardship.",friday,2026-02-02,2026-02-06
248,elope,"to run away secretly in order to get married, usually without parental consent.",friday,2026-02-02,2026-02-06
249,brazenly,"in a shameless, bold, or openly defiant manner.",friday,2026-02-02,2026-02-06
250,crevice,"a narrow opening or crack, especially in a rock or surface.",friday,2026-02-02,2026-02-06
251,miser,a person who hoards wealth and spends as little money as possible.,monday,2026-02-09,2026-02-09
252,vigor,"physical strength, energy, or enthusiasm.",monday,2026-02-09,2026-02-09
253,dabble,to take part in an activity in a casual or superficial way.,monday,2026-02-09,2026-02-09
254,abdicate,"to formally give up a position of power or responsibility, especially that of a monarch.",monday,2026-02-09,2026-02-09
255,bigamy,the crime of marrying another person while already legally married to someone else.,monday,2026-02-09,2026-02-09
256,ostracize,to exclude someone from a group or society deliberately.,monday,2026-02-09,2026-02-09
257,reckon,"to think, believe, or suppose; to calculate or estimate.",monday,2026-02-09,2026-02-09
258,esteem,"respect and admiration, typically for a person.",monday,2026-02-09,2026-02-09
259,ascetic,"practicing severe self-discipline and abstention from all forms of indulgence, often for religious reasons.",monday,2026-02-09,2026-02-09
260,maelstrom,a situation or state of confused movement or violent turmoil.,monday,2026-02-09,2026-02-09
261,churn,to stir or agitate vigorously; to move something about intensely.,tuesday,2026-02-09,2026-02-10
262,inherent,existing as a natural or essential part of something.,tuesday,2026-02-09,2026-02-10
263,embroil,"to involve someone deeply in an argument, conflict, or difficult situation.",tuesday,2026-02-09,2026-02-10
264,enmesh,to entangle or involve someone in a difficult or complicated situation from which it is hard to escape.,tuesday,2026-02-09,2026-02-10
265,interminable,"endless or seemingly endless, often in a tiresome or boring way.",tuesday,2026-02-09,2026-02-10
266,pathological,relating to or caused by disease; compulsive or obsessive in behavior.,tuesday,2026-02-09,2026-02-10
267,unhinged,mentally unbalanced; deranged.,tuesday,2026-02-09,2026-02-10
268,buoyancy,the ability to float in water or air; cheerfulness and resilience; economic success.,tuesday,2026-02-09,2026-02-10
269,gravitate,to be drawn or attracted toward something or someone.,tuesday,2026-02-09,2026-02-10
270,gregarious,sociable; enjoying the company of others.,tuesday,2026-02-09,2026-02-10
271,folly,lack of good sense or judgment; foolishness.,wednesday,2026-02-09,2026-02-11
272,malady,a disease or disorder of the body or mind.,wednesday,2026-02-09,2026-02-11
273,mercenary,a person primarily concerned with making money at the expense of ethics; or a professional soldier hired to serve in a foreign army.,wednesday,2026-02-09,2026-02-11
274,condottiere,a leader of a band of mercenary soldiers in Italy between the 14th and 16th centuries.,wednesday,2026-02-09,2026-02-11
275,toil,"hard, continuous, and exhausting work.",wednesday,2026-02-09,2026-02-11
276,valiant,possessing or showing courage or determination.,wednesday,2026-02-09,2026-02-11
277,galore,in plentiful or abundant amounts; in great quantities.,wednesday,2026-02-09,2026-02-11
278,insinuate,"to suggest or hint at something, usually something negative, in an indirect way.",wednesday,2026-02-09,2026-02-11
279,aversion,a strong feeling of dislike or opposition toward something.,wednesday,2026-02-09,2026-02-11
280,antipathy,a deep-seated feeling of dislike; aversion.,wednesday,2026-02-09,2026-02-11
281,conservative,averse to change or innovation; favoring traditional views or values.,thursday,2026-02-09,2026-02-12
282,finagle,"to obtain something by cunning, trickery, or dishonest means.",thursday,2026-02-09,2026-02-12
283,edifice,"a large, imposing building; or a complex system of beliefs.",thursday,2026-02-09,2026-02-12
284,hurl,to throw something with great force.,thursday,2026-02-09,2026-02-12
285,intensive,involving a lot of effort or activity in a short period of time.,thursday,2026-02-09,2026-02-12
286,extensive,covering a large area; having a wide range or scope.,thursday,2026-02-09,2026-02-12
287,sullen,bad-tempered and sulky; unwilling to smile or be sociable.,thursday,2026-02-09,2026-02-12
288,glower,to have an angry or sullen facial expression; to scowl.,thursday,2026-02-09,2026-02-12
289,scowl,to frown in an angry or bad-tempered way.,thursday,2026-02-09,2026-02-12
290,sag,"to sink, droop, or settle downward from pressure or lack of strength.",thursday,2026-02-09,2026-02-12
291,charlatan,a person falsely claiming to have special knowledge or skills; a fraud.,friday,2026-02-09,2026-02-13
292,retinue,"a group of assistants, advisers, or followers accompanying an important person.",friday,2026-02-09,2026-02-13
293,cynical,distrustful of human sincerity or goodness; believing people are motivated by self-interest.,friday,2026-02-09,2026-02-13
294,brazenly,in a bold and shameless way; without attempt to hide.,friday,2026-02-09,2026-02-13
295,inconsequential,not important or significant; trivial.,friday,2026-02-09,2026-02-13
296,relinquish,to voluntarily give up or surrender something.,friday,2026-02-09,2026-02-13
297,machiavellian,"cunning, scheming, and unscrupulous, especially in politics or in advancing one's career.",friday,2026-02-09,2026-02-13
298,unscrupulous,showing no moral principles; dishonest or unfair.,friday,2026-02-09,2026-02-13
299,guile,sly or cunning intelligence; the use of clever but dishonest methods to deceive.,friday,2026-02-09,2026-02-13
300,quintessence,the most perfect or typical example of a quality or class.,friday,2026-02-09,2026-02-13
301,poised,"having a calm, confident, and self-assured manner, especially in difficult situations.",monday,2026-02-16,2026-02-16
302,intercede,"to intervene or mediate on behalf of another person, especially to resolve a dispute.",monday,2026-02-16,2026-02-16
303,clemency,mercy or leniency shown towards someone who could be punished harshly.,monday,2026-02-16,2026-02-16
304,dire,"extremely serious or urgent, often involving danger or disaster.",monday,2026-02-16,2026-02-16
305,pre-eminent,surpassing all others; very distinguished in a particular field.,monday,2026-02-16,2026-02-16
306,rhetoric,"the art of effective or persuasive speaking or writing, often using figures of speech and other compositional techniques.",monday,2026-02-16,2026-02-16
307,pragmatic,dealing with problems or situations in a practical and sensible way rather than relying on theory or idealism.,monday,2026-02-16,2026-02-16
308,aggrandize,"to increase the power, status, wealth, or reputation of something or someone, often to an excessive degree.",monday,2026-02-16,2026-02-16
309,proselytize,"to try to convert someone to a different religion, belief, or opinion.",monday,2026-02-16,2026-02-16
310,uncanny,"strange or mysterious, especially in an unsettling way.",monday,2026-02-16,2026-02-16
311,magnate,"a wealthy and influential person, especially in business.",tuesday,2026-02-16,2026-02-17
312,clairvoyant,a person who claims to have the ability to see events in the future or beyond normal sensory contact.,tuesday,2026-02-16,2026-02-17
313,insinuation,"an indirect or subtle suggestion, typically of something unpleasant or discreditable.",tuesday,2026-02-16,2026-02-17
314,coaxing,gently persuading someone to do something by using flattery or persistent effort.,tuesday,2026-02-16,2026-02-17
315,cajole,to persuade someone to do something through repeated coaxing or flattery.,tuesday,2026-02-16,2026-02-17
316,vehement,"showing strong, forceful, and passionate feelings.",tuesday,2026-02-16,2026-02-17
317,incredulity,the state of being unable or unwilling to believe something; disbelief.,tuesday,2026-02-16,2026-02-17
318,innocuous,not harmful or offensive; unlikely to cause injury or offense.,tuesday,2026-02-16,2026-02-17
319,aloof,not friendly or forthcoming; distant and reserved.,tuesday,2026-02-16,2026-02-17
320,embers,"small, glowing pieces of coal or wood in a dying fire.",tuesday,2026-02-16,2026-02-17
321,bout,a short period of intense activity of a specified kind.,wednesday,2026-02-16,2026-02-18
322,scoundrel,a dishonest or unscrupulous person.,wednesday,2026-02-16,2026-02-18
323,wily,"skilled at gaining an advantage, especially through deceit or cleverness.",wednesday,2026-02-16,2026-02-18
324,effusive,"expressing feelings of gratitude, pleasure, or approval in an unrestrained or heartfelt manner.",wednesday,2026-02-16,2026-02-18
325,vie,to compete eagerly with others in order to achieve something.,wednesday,2026-02-16,2026-02-18
326,whim,"a sudden or impulsive desire or change of mind, especially one that is unusual or unexplained.",wednesday,2026-02-16,2026-02-18
327,fawn,to give someone excessive flattery or attention in order to gain favor; to behave obsequiously.,wednesday,2026-02-16,2026-02-18
328,smother,to kill someone by covering their nose and mouth to prevent breathing; to suffocate.,wednesday,2026-02-16,2026-02-18
329,tenet,"a principle, belief, or doctrine that is generally held to be true, especially by a group or organization.",wednesday,2026-02-16,2026-02-18
330,axiom,"a statement or proposition that is regarded as being established, accepted, or self-evidently true.",wednesday,2026-02-16,2026-02-18
331,codify,"to arrange laws, rules, or principles into a systematic and organized code or system.",thursday,2026-02-16,2026-02-19
332,caress,to touch or stroke gently and lovingly.,thursday,2026-02-16,2026-02-19
333,acclimatize,"to become accustomed or adapted to a new climate, environment, or situation.",thursday,2026-02-16,2026-02-19
334,abysmal,extremely bad; appalling.,thursday,2026-02-16,2026-02-19
335,penance,"voluntary self-punishment or an act showing repentance for wrongdoing, especially as a religious duty.",thursday,2026-02-16,2026-02-19
336,benevolence,kindness and a desire to do good for others; goodwill.,thursday,2026-02-16,2026-02-19
337,veracity,conformity to facts; accuracy; truthfulness.,thursday,2026-02-16,2026-02-19
338,devoid,entirely lacking or free from something.,thursday,2026-02-16,2026-02-19
339,inundate,to overwhelm someone with things or people to be dealt with; to flood.,thursday,2026-02-16,2026-02-19
340,arduous,involving or requiring a lot of effort; very difficult and tiring.,thursday,2026-02-16,2026-02-19
341,despotism,"the exercise of absolute power, especially in a cruel and oppressive way.",friday,2026-02-16,2026-02-20
342,disrepute,the state of being held in low esteem or regarded with disapproval by the public.,friday,2026-02-16,2026-02-20
343,arbiter,a person who has the authority to settle disputes or make judgments.,friday,2026-02-16,2026-02-20
344,anarchy,a state of disorder due to the absence or failure of government or authority.,friday,2026-02-16,2026-02-20
345,impeccable,in accordance with the highest standards; faultless.,friday,2026-02-16,2026-02-20
346,unorthodox,"contrary to what is usual, traditional, or accepted; not orthodox.",friday,2026-02-16,2026-02-20
347,sangfroid,"composure or coolness, especially in difficult or dangerous situations.",friday,2026-02-16,2026-02-20
348,melancholy,"a deep, persistent, and often pensive sadness.",friday,2026-02-16,2026-02-20
349,sagacious,having or showing keen mental discernment and good judgment; wise.,friday,2026-02-16,2026-02-20
350,dauntless,showing fearlessness and determination.,friday,2026-02-16,2026-02-20
351,august,respected and impressive; having great importance and dignity.,monday,2026-02-23,2026-02-23
352,lofty,"of imposing height; elevated in rank, character, or quality.",monday,2026-02-23,2026-02-23
353,girdle,to encircle or surround something.,monday,2026-02-23,2026-02-23
354,ingress,the act of entering or the entrance to a place.,monday,2026-02-23,2026-02-23
355,egress,the act of leaving or exiting a place.,monday,2026-02-23,2026-02-23
356,frenzy,a state of uncontrolled excitement or wild behavior.,monday,2026-02-23,2026-02-23
357,amply,in a way that is more than sufficient; generously.,monday,2026-02-23,2026-02-23
358,engender,"to cause a feeling, situation, or condition to exist or develop.",monday,2026-02-23,2026-02-23
359,juxtapose,"to place things side by side, especially for comparison or contrast.",monday,2026-02-23,2026-02-23
360,propitious,giving or indicating a good chance of success; favorable.,monday,2026-02-23,2026-02-23
361,preliminary,preceding or preparing for something fuller or more important; introductory.,tuesday,2026-02-23,2026-02-24
362,fleece,"to obtain a large amount of money from someone, typically by deceit or overcharging.",tuesday,2026-02-23,2026-02-24
363,avarice,extreme greed for wealth or material gain.,tuesday,2026-02-23,2026-02-24
364,meager,lacking in quantity or quality; insufficient.,tuesday,2026-02-23,2026-02-24
365,chinks,"narrow openings, cracks, or slits, especially ones that admit light.",tuesday,2026-02-23,2026-02-24
366,delegate,"a person chosen or elected to represent others, especially at a conference or meeting.",tuesday,2026-02-23,2026-02-24
367,allusion,"an indirect reference to a person, place, event, or literary work.",tuesday,2026-02-23,2026-02-24
368,oblique,not explicit or done in a direct way; indirect.,tuesday,2026-02-23,2026-02-24
369,disparaging,expressing the opinion that something or someone is of little worth; derogatory.,tuesday,2026-02-23,2026-02-24
370,requite,"to make an appropriate return for (a favor, service, or wrongdoing); to reciprocate.",tuesday,2026-02-23,2026-02-24
371,unctuous,excessively or insincerely flattering; oily in manner or speech.,wednesday,2026-02-23,2026-02-25
372,emanate,to originate from; to spread out or issue from a source.,wednesday,2026-02-23,2026-02-25
373,détente,"the easing of hostility or strained relations, especially between countries.",wednesday,2026-02-23,2026-02-25
374,concession,"something given up or allowed in response to demands, often during negotiations.",wednesday,2026-02-23,2026-02-25
375,perfidious,deceitful and untrustworthy; deliberately disloyal.,wednesday,2026-02-23,2026-02-25
376,subliminally,affecting the mind without conscious awareness.,wednesday,2026-02-23,2026-02-25
377,avid,"having or showing a keen interest, enthusiasm, or desire for something.",wednesday,2026-02-23,2026-02-25
378,subservient,prepared to obey others unquestioningly; submissive.,wednesday,2026-02-23,2026-02-25
379,tumultuous,"making a loud, confused noise; characterized by disorder or chaos.",wednesday,2026-02-23,2026-02-25
380,fervor,intense and passionate feeling.,wednesday,2026-02-23,2026-02-25
381,subpoena,a legal document ordering someone to attend court as a witness or to produce evidence.,thursday,2026-02-23,2026-02-26
382,martyr,"a person who is killed or suffers greatly for a religious, political, or other cause.",thursday,2026-02-23,2026-02-26
383,derision,contemptuous ridicule or mockery; being laughed at as worthless or stupid.,thursday,2026-02-23,2026-02-26
384,grotesque,"comically or repulsively ugly, distorted, or inappropriate to a shocking degree.",thursday,2026-02-23,2026-02-26
385,dissension,"strong disagreement or difference of opinion, especially leading to discord within a group.",thursday,2026-02-23,2026-02-26
386,ecstatic,feeling or expressing overwhelming happiness or joyful excitement.,thursday,2026-02-23,2026-02-26
387,eminence,"the state of being famous, respected, or important.",thursday,2026-02-23,2026-02-26
388,contrived,deliberately created rather than arising naturally; artificial or forced.,thursday,2026-02-23,2026-02-26
389,dexterity,skill and ease in using one's hands or body.,thursday,2026-02-23,2026-02-26
390,fawn,"to praise or flatter someone excessively, often in a way that seems insincere.",thursday,2026-02-23,2026-02-26
391,prattle,to talk at length in a foolish or inconsequential way.,friday,2026-02-23,2026-02-27
392,frugal,careful in the use of resources; economical or sparing.,friday,2026-02-23,2026-02-27
393,avow,to assert or confess openly and publicly.,friday,2026-02-23,2026-02-27
394,pliable,"easily bent, shaped, or influenced.",friday,2026-02-23,2026-02-27
395,apt,having a tendency to do something; likely.,friday,2026-02-23,2026-02-27
396,pseudo,not genuine; false or pretended; sham.,friday,2026-02-23,2026-02-27
397,spurious,not being what it purports to be; false or fake.,friday,2026-02-23,2026-02-27
398,sham,"something that is false, fake, or not what it is claimed to be.",friday,2026-02-23,2026-02-27
399,barbaric,"savagely cruel, brutal, or primitive.",friday,2026-02-23,2026-02-27
400,chumminess,"close friendship or intimacy; a friendly, informal manner.",friday,2026-02-23,2026-02-27
401,obnoxious,"extremely unpleasant or offensive, often causing annoyance or discomfort.",monday,2026-03-02,2026-03-02
402,ludicrous,"so foolish, unreasonable, or out of place as to be amusing; ridiculous.",monday,2026-03-02,2026-03-02
403,scoff,"to speak to someone or about something in a mocking, scornful, or derisive way.",monday,2026-03-02,2026-03-02
404,bizarre,"very strange or unusual, especially to the point of being striking or outlandish.",monday,2026-03-02,2026-03-02
405,fallible,capable of making mistakes or being wrong; not infallible.,monday,2026-03-02,2026-03-02
406,Scylla and Charybdis,to be caught between two equally dangerous or difficult alternatives.,monday,2026-03-02,2026-03-02
407,placate,"to make someone less angry or hostile, usually by yielding or offering concessions.",monday,2026-03-02,2026-03-02
408,province,"an administrative division or region within a country, typically governed by its own local authorities.",monday,2026-03-02,2026-03-02
409,rube,"a naive, unsophisticated, or inexperienced person, especially from a rural area.",monday,2026-03-02,2026-03-02
410,foist,to force someone to accept or deal with something unwanted or unwelcome.,monday,2026-03-02,2026-03-02
411,indelible,"making marks that cannot be removed, erased, or forgotten.",tuesday,2026-03-02,2026-03-03
412,Proteus,a figure from Greek mythology known for his ability to change shape; also used to describe something highly adaptable or versatile.,tuesday,2026-03-02,2026-03-03
413,supple,bending and moving easily and gracefully; flexible.,tuesday,2026-03-02,2026-03-03
414,arrant,"complete and utter, often used to emphasize something negative.",tuesday,2026-03-02,2026-03-03
415,raucous,"making or constituting a disturbingly harsh, loud, or boisterous noise.",tuesday,2026-03-02,2026-03-03
416,portentous,"done in a pompous, overly solemn, or self-important manner so as to impress; also, indicating a future event.",tuesday,2026-03-02,2026-03-03
417,prosaic,"dull, uninteresting, or lacking imagination; commonplace.",tuesday,2026-03-02,2026-03-03
418,protean,able to change frequently or easily; versatile.,tuesday,2026-03-02,2026-03-03
419,promethean,"boldly creative, innovative, or original, often in a way that is daring or defiant.",tuesday,2026-03-02,2026-03-03
420,histrionic,"excessively theatrical or dramatic in character, style, or behavior.",tuesday,2026-03-02,2026-03-03
421,mutiny,"an open rebellion against the proper authorities, especially by soldiers or sailors.",wednesday,2026-03-02,2026-03-04
422,contrive,"to create or bring about deliberately, often by clever or artificial means.",wednesday,2026-03-02,2026-03-04
423,acquiesce,to accept something reluctantly but without protest.,wednesday,2026-03-02,2026-03-04
424,extricate,to free someone or something from a constraint or difficult situation.,wednesday,2026-03-02,2026-03-04
425,paradigm,"a typical example, model, or pattern of something; a framework of concepts.",wednesday,2026-03-02,2026-03-04
426,totem,"an object, animal, or symbol that is respected or revered by a group, often as an emblem.",wednesday,2026-03-02,2026-03-04
427,savoury,(in British usage) having a salty or spicy flavor rather than a sweet one; (in other contexts) morally wholesome or socially acceptable.,wednesday,2026-03-02,2026-03-04
428,rile,to make someone annoyed or irritated.,wednesday,2026-03-02,2026-03-04
429,penitent,feeling or showing remorse or regret for wrongdoing.,wednesday,2026-03-02,2026-03-04
430,rational,"based on reason, logic, or clear thinking.",wednesday,2026-03-02,2026-03-04
431,subterfuge,deceit used in order to achieve one's goal; a trick or stratagem.,thursday,2026-03-02,2026-03-05
432,fledge,"(of a young bird) to develop wing feathers that are large enough for flight; by extension, to become fully developed.",thursday,2026-03-02,2026-03-05
433,gargantuan,extremely large; enormous.,thursday,2026-03-02,2026-03-05
434,transcendental,relating to a spiritual or non-physical realm; beyond ordinary experience or understanding.,thursday,2026-03-02,2026-03-05
435,wane,"to decrease in size, extent, or degree; to become weaker.",thursday,2026-03-02,2026-03-05
436,alchemy,"a medieval practice aimed at turning base metals into gold; more broadly, a process of transformation or creation.",thursday,2026-03-02,2026-03-05
437,gimmick,"a trick, device, or novelty intended to attract attention or increase appeal.",thursday,2026-03-02,2026-03-05
438,quaint,attractively unusual or old-fashioned.,thursday,2026-03-02,2026-03-05
439,resonance,"the quality of having a lasting effect or significance, often because it relates to one's own experiences or beliefs.",thursday,2026-03-02,2026-03-05
440,veneer,"a thin decorative covering of fine material over a coarser one; also, a superficial or deceptive appearance.",thursday,2026-03-02,2026-03-05
441,profundity,"great depth of insight, knowledge, or meaning.",friday,2026-03-02,2026-03-06
442,corollary,"a direct or natural consequence or result, often derived from an already proven proposition.",friday,2026-03-02,2026-03-06
443,panacea,a solution or remedy for all problems or difficulties; a cure-all.,friday,2026-03-02,2026-03-06
444,peer,"to look closely or with difficulty, often in an attempt to see something more clearly.",friday,2026-03-02,2026-03-06
445,wits,the ability to think quickly and intelligently; mental sharpness.,friday,2026-03-02,2026-03-06
446,timid,showing a lack of courage or confidence; easily frightened.,friday,2026-03-02,2026-03-06
447,errant,straying from the proper course or standards; behaving wrongly.,friday,2026-03-02,2026-03-06
448,torrent,"a sudden, violent, and copious outpouring of (something, typically water or words).",friday,2026-03-02,2026-03-06
449,improbable,not likely to happen or be true; unlikely.,friday,2026-03-02,2026-03-06
450,lampoon,to publicly criticize or ridicule someone or something using satire.,friday,2026-03-02,2026-03-06
451,refectory,"a large dining hall, especially in a monastery, college, or other institution.",monday,2026-03-09,2026-03-09
452,genuflect,to bend one or both knees as a sign of respect or worship.,monday,2026-03-09,2026-03-09
453,lechery,excessive or offensive sexual desire; lustfulness.,monday,2026-03-09,2026-03-09
454,bequeath,"to leave money, property, or possessions to someone by a will after death.",monday,2026-03-09,2026-03-09
455,seldom,almost never; rarely.,monday,2026-03-09,2026-03-09
456,nettle,"to irritate, annoy, or provoke someone.",monday,2026-03-09,2026-03-09
457,bourgeois,"belonging to or characteristic of the middle class, typically with reference to its perceived materialistic values or conventional attitudes.",monday,2026-03-09,2026-03-09
