id,word,meaning,day,week_start,date_sent
691,assertive,having or showing a confident and forceful personality.,friday,2026-04-06,2026-04-10
692,stigma,"a mark of disgrace or strong social disapproval associated with a particular circumstance, quality, or person.",friday,2026-04-06,2026-04-10
693,atrophy,the gradual decline or wasting away of effectiveness or vigor due to underuse or neglect.,friday,2026-04-06,2026-04-10
694,purge,"to remove people or things suddenly and decisively, often violently.",friday,2026-04-06,2026-04-10
695,dogmatic,expressing personal opinions or beliefs as if they are certainly correct and cannot be doubted.,friday,2026-04-06,2026-04-10
696,convalesce,to recover health and strength gradually after illness or medical treatment.,friday,2026-04-06,2026-04-10
697,celibacy,the state of abstaining from marriage and sexual relations.,friday,2026-04-06,2026-04-10
698,epitome,a person or thing that is a perfect example of a particular quality or type.,friday,2026-04-06,2026-04-10
699,plight,"a dangerous, difficult, or otherwise unfortunate situation.",friday,2026-04-06,2026-04-10
700,snob,"a person who believes they are superior to others, especially in matters of taste or social class.",friday,2026-04-06,2026-04-10
701,latent,"existing but not yet visible, active, or obvious; present but undeveloped.",monday,2026-04-13,2026-04-13
702,malcontent,"a person who is dissatisfied and rebellious, often complaining about the status quo.",monday,2026-04-13,2026-04-13
703,paucity,the presence of something in only small or insufficient quantities or amounts; scarcity.,monday,2026-04-13,2026-04-13
704,ploy,a cunning plan or action designed to turn a situation to one's own advantage.,monday,2026-04-13,2026-04-13
705,duress,"threats, violence, or other action used to coerce someone into doing something against their will.",monday,2026-04-13,2026-04-13
706,intricate,"very complicated or detailed, with many interconnected parts.",monday,2026-04-13,2026-04-13
707,excruciating,intensely painful; causing great suffering or distress.,monday,2026-04-13,2026-04-13
708,meander,to wander or move about aimlessly and without a fixed direction.,monday,2026-04-13,2026-04-13
709,idiosyncracy,"a characteristic, habit, or mannerism particular to an individual.",monday,2026-04-13,2026-04-13
710,tic,"a habitual, usually unconscious, spasmodic contraction of certain muscles; a repeated, involuntary action or gesture.",monday,2026-04-13,2026-04-13
711,anecdote,"a short, often amusing or interesting story about a real incident or person.",tuesday,2026-04-13,2026-04-14
712,physiognomy,"the facial features or expression, especially when regarded as indicative of character or ethnic origin.",tuesday,2026-04-13,2026-04-14
713,don,to put on (an article of clothing or accessory).,tuesday,2026-04-13,2026-04-14
714,bravado,a bold manner or show of boldness intended to impress or intimidate others.,tuesday,2026-04-13,2026-04-14
715,rail,to criticize or complain bitterly and vehemently.,tuesday,2026-04-13,2026-04-14
716,bane,"a cause of great distress, annoyance, or ruin.",tuesday,2026-04-13,2026-04-14
717,parasol,"a light umbrella, typically used to provide shade from the sun.",tuesday,2026-04-13,2026-04-14
718,glean,"to gather information or material bit by bit, often with difficulty.",tuesday,2026-04-13,2026-04-14
719,semitic,"relating to a group of languages (including Hebrew, Arabic, and Aramaic) and the peoples who speak them.",tuesday,2026-04-13,2026-04-14
720,lingerie,women's undergarments; typically attractive and delicate clothing worn next to the skin.,tuesday,2026-04-13,2026-04-14
721,lopsided,with one side lower or smaller than the other; uneven or unbalanced.,wednesday,2026-04-13,2026-04-15
722,connotation,an idea or feeling that a word invokes in addition to its literal or primary meaning.,wednesday,2026-04-13,2026-04-15
723,seamless,"smooth and continuous, with no apparent gaps or transitions.",wednesday,2026-04-13,2026-04-15
724,compulsive,"resulting from or relating to an irresistible urge, especially one that is against one's conscious wishes.",wednesday,2026-04-13,2026-04-15
725,adversity,a difficult or unpleasant situation; hardship or misfortune.,wednesday,2026-04-13,2026-04-15
726,dote,"to show excessive love or fondness for someone, often to the point of being adoring or uncritical.",wednesday,2026-04-13,2026-04-15
727,meticulous,showing great attention to detail; very careful and precise.,wednesday,2026-04-13,2026-04-15
728,veto,to refuse to allow or approve something; to reject a decision or proposal.,wednesday,2026-04-13,2026-04-15
729,prestigious,inspiring respect and admiration; having high status or reputation.,wednesday,2026-04-13,2026-04-15
730,obscurity,"the state of being unknown, inconspicuous, or unimportant.",wednesday,2026-04-13,2026-04-15
731,invaluable,extremely useful; indispensable; beyond calculable value.,thursday,2026-04-13,2026-04-16
732,indispensable,absolutely necessary; essential and cannot be done without.,thursday,2026-04-13,2026-04-16
733,snag,an unexpected or hidden obstacle or problem.,thursday,2026-04-13,2026-04-16
734,malignant,evil in nature or effect; (in medicine) very harmful and likely to spread or worsen.,thursday,2026-04-13,2026-04-16
735,pernicious,"having a harmful effect, especially in a gradual or subtle way.",thursday,2026-04-13,2026-04-16
736,stodgy,"dull, uninspired, and lacking in excitement or interest.",thursday,2026-04-13,2026-04-16
737,gnawing,"persistently worrying, distressing, or causing discomfort.",thursday,2026-04-13,2026-04-16
738,itinerant,"a person who travels from place to place, typically for work.",thursday,2026-04-13,2026-04-16
739,covetousness,an intense desire to possess something that belongs to someone else; greed.,thursday,2026-04-13,2026-04-16
740,androgynous,having both male and female characteristics; not distinctly masculine or feminine.,thursday,2026-04-13,2026-04-16
741,saunter,"to walk in a slow, relaxed manner, often without any particular goal.",friday,2026-04-13,2026-04-17
742,ethereal,extremely delicate and light; seeming too perfect for this world.,friday,2026-04-13,2026-04-17
743,passe,no longer fashionable or in style; out of date.,friday,2026-04-13,2026-04-17
744,pillory,to publicly attack or ridicule someone.,friday,2026-04-13,2026-04-17
745,ubiquity,"the state of being present, appearing, or found everywhere.",friday,2026-04-13,2026-04-17
746,grope,"to touch or feel someone or something clumsily or without permission, often in a sexual way.",friday,2026-04-13,2026-04-17
747,pique,"a feeling of resentment or irritation, often resulting from a slight or indignity.",friday,2026-04-13,2026-04-17
748,piquant,pleasantly stimulating or exciting to the mind; intriguing or provocative.,friday,2026-04-13,2026-04-17
749,unabated,"without any reduction in intensity, strength, or force.",friday,2026-04-13,2026-04-17
750,dredging,"the act of bringing up or clearing something from a body of water, or metaphorically, bringing up old memories or issues.",friday,2026-04-13,2026-04-17
751,superficial,"existing or occurring at or on the surface; not thorough, deep, or complete.",monday,2026-04-20,2026-04-20
752,objectify,"to treat a person as an object or thing, without regard for their dignity or individuality.",monday,2026-04-20,2026-04-20
753,voyeurism,the practice of gaining sexual pleasure from watching others when they are naked or engaged in sexual activity.,monday,2026-04-20,2026-04-20
754,beckon,"to make a gesture with the hand, arm, or head to encourage someone to come nearer or follow.",monday,2026-04-20,2026-04-20
755,dispense,"to distribute or provide (a service or item); to manage without or get rid of (when used with ""with"").",monday,2026-04-20,2026-04-20
756,offset,to counterbalance or compensate for something with an equal and opposite force or effect.,monday,2026-04-20,2026-04-20
757,apprehension,anxiety or fear that something bad or unpleasant will happen; understanding or grasp.,monday,2026-04-20,2026-04-20
758,dread,great fear or apprehension about something that may happen.,monday,2026-04-20,2026-04-20
759,lewd,crude and offensive in a sexual way.,monday,2026-04-20,2026-04-20
760,impish,mischievous or inclined to do slightly naughty things for fun.,monday,2026-04-20,2026-04-20
761,spurn,to reject disdainfully or contemptuously.,tuesday,2026-04-20,2026-04-21
762,sentiment,a view or opinion based on emotion or feeling rather than reason.,tuesday,2026-04-20,2026-04-21
763,serf,an agricultural laborer bound under the feudal system to work on his lord's estate.,tuesday,2026-04-20,2026-04-21
764,despondent,in low spirits from loss of hope or courage; dejected.,tuesday,2026-04-20,2026-04-21
765,galoshes,waterproof overshoes worn to protect regular shoes from rain or mud.,tuesday,2026-04-20,2026-04-21
766,sporadically,"occurring at irregular intervals; occasionally, not continuously.",tuesday,2026-04-20,2026-04-21
767,scrimped,to spend as little money as possible; to be thrifty or parsimonious.,tuesday,2026-04-20,2026-04-21
768,parsimonious,extremely unwilling to spend money or use resources; stingy or frugal.,tuesday,2026-04-20,2026-04-21
769,thrifty,using money and other resources carefully and not wastefully.,tuesday,2026-04-20,2026-04-21
770,resigned,having accepted something unpleasant that cannot be changed.,tuesday,2026-04-20,2026-04-21
771,wean,"to gradually stop a person or young animal from depending on something, especially mother's milk or a particular habit.",wednesday,2026-04-20,2026-04-22
772,deteriorate,to become progressively worse.,wednesday,2026-04-20,2026-04-22
773,substantial,"of considerable importance, size, or worth; strongly built or made.",wednesday,2026-04-20,2026-04-22
774,reforms,"changes made to improve a system, organization, or practice.",wednesday,2026-04-20,2026-04-22
775,derisory,ridiculously small or inadequate.,wednesday,2026-04-20,2026-04-22
776,agglomeration,a mass or collection of things; an assemblage.,wednesday,2026-04-20,2026-04-22
777,vestige,a trace or remnant of something that is disappearing or no longer exists.,wednesday,2026-04-20,2026-04-22
778,psychosomatic,(of a physical illness or other condition) caused or aggravated by a mental factor such as internal conflict or stress.,wednesday,2026-04-20,2026-04-22
779,dreary,"dull, bleak, and lifeless; depressing.",wednesday,2026-04-20,2026-04-22
780,pollyanna,a person who is excessively cheerful or optimistic.,wednesday,2026-04-20,2026-04-22
781,protestant,a member or follower of any of the Western Christian churches separate from the Roman Catholic Church.,thursday,2026-04-20,2026-04-23
782,faculty,an inherent mental or physical power; a natural ability for a particular activity.,thursday,2026-04-20,2026-04-23
783,immoderate,not sensible or restrained; excessive.,thursday,2026-04-20,2026-04-23
784,extol,to praise enthusiastically.,thursday,2026-04-20,2026-04-23
785,abuzz,filled with a continuous buzzing or humming sound; full of lively activity.,thursday,2026-04-20,2026-04-23
786,pomp,"a showy or ostentatious display, especially at a ceremonial event.",thursday,2026-04-20,2026-04-23
787,rapport,a close and harmonious relationship in which people understand each other's feelings or ideas.,thursday,2026-04-20,2026-04-23
788,elaborate,involving many carefully arranged parts or details; complicated and detailed.,thursday,2026-04-20,2026-04-23
789,temperament,"a person or animal's nature, especially as it affects their behavior.",thursday,2026-04-20,2026-04-23
790,lopsided,"with one side larger, higher, or heavier than the other; uneven.",thursday,2026-04-20,2026-04-23
791,marginalize,"to treat a person, group, or concept as insignificant or peripheral.",friday,2026-04-20,2026-04-24
792,contrition,the state of feeling remorseful and penitent.,friday,2026-04-20,2026-04-24
793,ostinato rigore,"relentless or unyielding rigor, especially in pursuit of perfection.",friday,2026-04-20,2026-04-24
794,staunchly,in a very loyal and committed manner.,friday,2026-04-20,2026-04-24
795,marred,damaged or spoiled to a certain extent; impaired.,friday,2026-04-20,2026-04-24
796,idyllic,"extremely happy, peaceful, or picturesque.",friday,2026-04-20,2026-04-24
797,picturesque,"visually attractive, especially in a quaint or charming way.",friday,2026-04-20,2026-04-24
798,quaint,attractively unusual or old-fashioned.,friday,2026-04-20,2026-04-24
799,unscathed,"without suffering any injury, damage, or harm.",friday,2026-04-20,2026-04-24
800,palpable,so intense or obvious as to be almost touched or felt; tangible.,friday,2026-04-20,2026-04-24
801,tangible,"perceptible by touch; clear and definite, real or concrete rather than abstract.",monday,2026-04-27,2026-04-27
802,solitary,existing or living alone; without companions; isolated.,monday,2026-04-27,2026-04-27
803,solemn,formal and dignified; showing sincerity and deep seriousness.,monday,2026-04-27,2026-04-27
804,segregated,"separated or set apart from others, often by force or law, typically referring to groups of people.",monday,2026-04-27,2026-04-27
805,virulent,extremely harmful or severe in its effects; bitterly hostile or malicious.,monday,2026-04-27,2026-04-27
806,solidarity,"unity or mutual support within a group, especially among individuals with common interests or goals.",monday,2026-04-27,2026-04-27
807,interloper,a person who becomes involved in a place or situation where they are not wanted or are considered not to belong.,monday,2026-04-27,2026-04-27
808,ostensibly,"apparently or purportedly, but perhaps not actually; seeming on the surface.",monday,2026-04-27,2026-04-27
809,solace,comfort or consolation in a time of distress or sadness.,monday,2026-04-27,2026-04-27
810,faltering,"losing strength, momentum, or confidence; hesitant or unsteady.",monday,2026-04-27,2026-04-27
811,bastion,"a stronghold or fortified place; something that defends or preserves a particular principle, activity, or group.",tuesday,2026-04-27,2026-04-28
812,mull,to think about deeply and at length; to ponder or consider.,tuesday,2026-04-27,2026-04-28
813,tepid,only slightly warm; showing little enthusiasm or interest.,tuesday,2026-04-27,2026-04-28
814,revitalized,"given new life, energy, or strength; rejuvenated.",tuesday,2026-04-27,2026-04-28
815,aide,"a person who assists another, especially a superior, in carrying out their duties.",tuesday,2026-04-27,2026-04-28
816,debilitating,making someone very weak or infirm; causing a loss of strength or ability.,tuesday,2026-04-27,2026-04-28
817,perturbed,"feeling anxious, unsettled, or upset.",tuesday,2026-04-27,2026-04-28
818,cohesion,the act or state of sticking together tightly; unity or forming a united whole.,tuesday,2026-04-27,2026-04-28
819,smorgasbord,a wide variety or diverse assortment of something.,tuesday,2026-04-27,2026-04-28
820,lucrative,highly profitable; producing a great deal of money or benefit.,tuesday,2026-04-27,2026-04-28
821,radically,in a thorough or fundamental way; completely or extremely.,wednesday,2026-04-27,2026-04-29
822,sterility,the inability to produce offspring; barrenness.,wednesday,2026-04-27,2026-04-29
823,repertoire,"a stock or collection of skills, techniques, works, or items that a person or group can perform or use.",wednesday,2026-04-27,2026-04-29
824,ineluctable,impossible to avoid or escape; inescapable.,wednesday,2026-04-27,2026-04-29
825,meander,"to follow a winding, intricate course; to wander aimlessly without urgent destination.",wednesday,2026-04-27,2026-04-29
826,imbibe,"to absorb or take in, especially ideas or knowledge; also, to drink (especially alcohol).",wednesday,2026-04-27,2026-04-29
827,visceral,relating to deep inward feelings rather than intellect; emotional or instinctive.,wednesday,2026-04-27,2026-04-29
828,prodding,"encouraging or urging someone to take action, often by persistent persuasion.",wednesday,2026-04-27,2026-04-29
829,panorama,"an unbroken, wide view of the whole region surrounding an observer.",wednesday,2026-04-27,2026-04-29
830,vantage,a position or place that provides a broad or advantageous perspective or view.,wednesday,2026-04-27,2026-04-29
831,fruition,"the point at which a plan, project, or idea is realized or completed successfully.",thursday,2026-04-27,2026-04-30
832,mired,stuck or entangled in something difficult or unpleasant; bogged down.,thursday,2026-04-27,2026-04-30
833,ecstasy,"an overwhelming feeling of great happiness, joy, or bliss.",thursday,2026-04-27,2026-04-30
834,cornucopia,an abundant supply of good things; a symbol of plenty and nourishment.,thursday,2026-04-27,2026-04-30
835,raison d'etre,the most important reason or purpose for someone or something’s existence.,thursday,2026-04-27,2026-04-30
836,siphon,"to gradually or stealthily take something away, especially resources or funds, often illegally or unfairly.",thursday,2026-04-27,2026-04-30
837,lurid,"very vivid in color, especially so as to create an unpleasantly harsh or unnatural effect; also, gruesome or shocking.",thursday,2026-04-27,2026-04-30
838,amount,"to be equivalent in seriousness, effect, or value to something.",thursday,2026-04-27,2026-04-30
839,tempestuous,"characterized by strong, turbulent, or conflicting emotions.",thursday,2026-04-27,2026-04-30
840,plunge,to jump or dive quickly and energetically; to suddenly descend or immerse.,thursday,2026-04-27,2026-04-30
841,invalid,"a person made weak or disabled by illness or injury; also, not valid or legally acceptable (context-dependent).",friday,2026-04-27,2026-05-01
842,approbation,"approval or praise, especially official or formal.",friday,2026-04-27,2026-05-01
843,proffer,to offer or present something for acceptance.,friday,2026-04-27,2026-05-01
844,unmitigated,"absolute, complete, or total; not diminished in any way.",friday,2026-04-27,2026-05-01
845,perpetrating,"the act of carrying out or committing a harmful, illegal, or immoral action.",friday,2026-04-27,2026-05-01
846,drivel,silly nonsense; trivial or senseless talk or ideas.,friday,2026-04-27,2026-05-01
847,admonish,to warn or reprimand someone firmly; to advise or urge earnestly.,friday,2026-04-27,2026-05-01
848,lavish,spending or giving in great amounts; extravagant or generous.,friday,2026-04-27,2026-05-01
849,consensus,a general or widespread agreement among all the members of a group.,friday,2026-04-27,2026-05-01
850,irate,feeling or characterized by intense anger.,friday,2026-04-27,2026-05-01
851,dilate,"to make or become wider, larger, or more open; also, to speak or write at length on a subject.",monday,2026-05-04,2026-05-04
852,cantankerous,"bad-tempered, argumentative, and uncooperative.",monday,2026-05-04,2026-05-04
853,tirade,"a long, angry speech of criticism or accusation.",monday,2026-05-04,2026-05-04
854,pristine,"in its original condition; unspoiled, untouched, or immaculately clean.",monday,2026-05-04,2026-05-04
855,glossary,"a brief dictionary or list providing explanations of terms, especially specific to a particular text.",monday,2026-05-04,2026-05-04
856,raconteur,a person skilled at telling stories and anecdotes in an engaging and entertaining way.,monday,2026-05-04,2026-05-04
857,non compos mentis,not of sound mind; mentally incapable of handling one’s own affairs.,monday,2026-05-04,2026-05-04
858,diplomatic,"skilled at dealing with people in a sensitive, effective, and tactful way, often involving negotiation.",monday,2026-05-04,2026-05-04
859,vitiation,"the process of impairing, spoiling, or weakening the quality or effectiveness of something.",monday,2026-05-04,2026-05-04
860,forbear,to refrain from doing something; to endure or tolerate something patiently and without complaint.,monday,2026-05-04,2026-05-04
861,sentiment,"a view, opinion, or feeling about something; an attitude or emotion.",tuesday,2026-05-04,2026-05-05
862,astride,"with a leg on each side of something, as when riding a bicycle or horse; extending across or spanning.",tuesday,2026-05-04,2026-05-05
863,alibi,"an excuse or defense offered to avoid blame or responsibility, especially proof of being elsewhere when a crime occurred.",tuesday,2026-05-04,2026-05-05
864,remonstrate,to make a forceful or earnest protest; to express strong disapproval or disagreement.,tuesday,2026-05-04,2026-05-05
865,estrange,to cause someone to no longer be close or affectionate; to alienate.,tuesday,2026-05-04,2026-05-05
866,christendom,the worldwide community of Christians; the Christian-dominated Western world.,tuesday,2026-05-04,2026-05-05
867,pithy,concise and forcefully expressive; brief but full of meaning.,tuesday,2026-05-04,2026-05-05
868,maxim,"a short, pithy statement expressing a general truth or rule of conduct.",tuesday,2026-05-04,2026-05-05
869,gall,"bold, impudent, or disrespectful behavior.",tuesday,2026-05-04,2026-05-05
870,beget,to father or sire a child; to cause or bring about.,tuesday,2026-05-04,2026-05-05
871,tread,"to walk, step, or press on something with the feet.",wednesday,2026-05-04,2026-05-06
872,conflagration,"a large, destructive fire causing significant damage.",wednesday,2026-05-04,2026-05-06
873,precinct,"a district or clearly defined area, often used for administrative or police purposes.",wednesday,2026-05-04,2026-05-06
874,cantankerous,"bad-tempered, argumentative, and uncooperative. *(Duplicate; see 852)*",wednesday,2026-05-04,2026-05-06
875,infallible,incapable of making mistakes or being wrong; always correct and reliable.,wednesday,2026-05-04,2026-05-06
876,maligned,"spoken about in a spiteful or damaging way, especially to harm someone's reputation.",wednesday,2026-05-04,2026-05-06
877,antacid,"a substance that neutralizes stomach acidity, used to relieve heartburn or indigestion.",wednesday,2026-05-04,2026-05-06
878,sordid,involving immoral or dishonorable actions and motives; dirty or squalid.,wednesday,2026-05-04,2026-05-06
879,penitentiary,a prison for people convicted of serious crimes.,wednesday,2026-05-04,2026-05-06
880,solicit,"to ask for or try to obtain something, especially money or help, from others.",wednesday,2026-05-04,2026-05-06
881,ikigai,a Japanese concept meaning “a reason for being”; having a sense of purpose in life.,thursday,2026-05-04,2026-05-07
882,kaizen,"a Japanese philosophy of continuous improvement, focusing on making small, incremental changes regularly.",thursday,2026-05-04,2026-05-07
883,shoshin,"a Japanese term meaning “beginner’s mind”; approaching things with openness, eagerness, and lack of preconceptions.",thursday,2026-05-04,2026-05-07
884,hara hachi bu,a Japanese practice of eating until you are about 80% full.,thursday,2026-05-04,2026-05-07
885,shinrin-yoku,"a Japanese term for “forest bathing”; spending time in nature, especially among trees, for relaxation and health.",thursday,2026-05-04,2026-05-07
886,wabi-sabi,a Japanese aesthetic concept finding beauty in imperfection and transience.,thursday,2026-05-04,2026-05-07
887,ganbaru,"a Japanese term meaning to do your best or persevere, no matter how difficult.",thursday,2026-05-04,2026-05-07
888,gaman,"a Japanese term meaning to show patience, endurance, and perseverance, especially during hardship.",thursday,2026-05-04,2026-05-07
889,lethargic,lacking in energy and enthusiasm; sluggish or apathetic.,thursday,2026-05-04,2026-05-07
890,preposterous,utterly absurd or ridiculous; contrary to reason or common sense.,thursday,2026-05-04,2026-05-07
891,pernicious,"having a harmful effect, especially in a gradual or subtle way.",friday,2026-05-04,2026-05-08
892,contingent,"dependent on certain conditions or circumstances; also, a group of people representing a larger group.",friday,2026-05-04,2026-05-08
893,angst,"a feeling of deep anxiety, worry, or dread, often about the human condition or personal circumstances.",friday,2026-05-04,2026-05-08
894,volition,the power or act of making one’s own choices or decisions; will.,friday,2026-05-04,2026-05-08
895,spurious,not genuine; false or fake; not being what it claims to be.,friday,2026-05-04,2026-05-08
896,paraphernalia,miscellaneous articles or equipment needed for a particular activity.,friday,2026-05-04,2026-05-08
897,galvanize,to shock or excite someone into taking action.,friday,2026-05-04,2026-05-08
898,fable,"a short story, typically with animals as characters, conveying a moral; also, to invent or tell stories.",friday,2026-05-04,2026-05-08
899,plethora,an excessive or large amount of something; overabundance.,friday,2026-05-04,2026-05-08
900,intrinsic,belonging naturally; inherent; essential to the nature of something.,friday,2026-05-04,2026-05-08
901,perpetuate,"to make something continue for a long time or indefinitely, often something undesirable.",monday,2026-05-11,2026-05-11
902,indefinitely,for an unlimited or unspecified period of time.,monday,2026-05-11,2026-05-11
903,posit,to put forward or assume as a fact or as a basis for argument.,monday,2026-05-11,2026-05-11
904,distinctive,having a quality or characteristic that makes something or someone easy to recognize as different from others.,monday,2026-05-11,2026-05-11
905,truncated,"shortened by having a part cut off; made briefer in duration, extent, or length.",monday,2026-05-11,2026-05-11
906,hindsight,understanding of a situation or event only after it has happened.,monday,2026-05-11,2026-05-11
907,status quo,the existing state or current condition of affairs.,monday,2026-05-11,2026-05-11
908,resuscitate,to revive someone from unconsciousness or apparent death.,monday,2026-05-11,2026-05-11
909,avid,having or showing a strong interest or enthusiasm for something.,monday,2026-05-11,2026-05-11
910,hurdle,"an obstacle, difficulty, or problem that must be overcome.",monday,2026-05-11,2026-05-11
