id,word,meaning,day,week_start,date_sent
1,overt,done or shown openly; not secret or hidden.,monday,2026-01-05,2026-01-05
2,congenial,pleasant because of having qualities or interests similar to one's own; friendly and agreeable.,monday,2026-01-05,2026-01-05
3,duplicity,deceitfulness; acting in two different ways to different people about the same matter.,monday,2026-01-05,2026-01-05
4,aristocracy,"the highest social class in certain societies, often holding hereditary titles or offices.",monday,2026-01-05,2026-01-05
5,courtiers,"attendants or advisers at a royal court, especially those who flatter to gain favor.",monday,2026-01-05,2026-01-05
6,refine,to remove impurities or unwanted elements from a substance; to improve by making small changes.,monday,2026-01-05,2026-01-05
7,dilemma,a situation in which a difficult choice has to be made between two or more alternatives.,monday,2026-01-05,2026-01-05
8,paragon,a person or thing regarded as a perfect example of a particular quality.,monday,2026-01-05,2026-01-05
9,invariably,always; in every case or on every occasion.,monday,2026-01-05,2026-01-05
10,elegance,"the quality of being graceful, stylish, and attractive in appearance or manner.",monday,2026-01-05,2026-01-05
11,coercion,the practice of persuading someone to do something by using force or threats.,tuesday,2026-01-05,2026-01-06
12,outright,completely and immediately; without reservation or concealment.,tuesday,2026-01-05,2026-01-06
13,treachery,betrayal of trust; deceptive action or nature.,tuesday,2026-01-05,2026-01-06
14,vigilance,the action or state of keeping careful watch for possible danger or difficulties.,tuesday,2026-01-05,2026-01-06
15,tactical,relating to or constituting actions carefully planned to gain a specific end.,tuesday,2026-01-05,2026-01-06
16,tact,skill and sensitivity in dealing with others or with difficult issues without causing offense.,tuesday,2026-01-05,2026-01-06
17,paradox,a statement or situation that seems self-contradictory or absurd but may be true.,tuesday,2026-01-05,2026-01-06
18,peculiar,strange or odd; unusual.,tuesday,2026-01-05,2026-01-06
19,pinnacle,the most successful point; the highest level or degree attainable.,tuesday,2026-01-05,2026-01-06
20,cauldron,"a large metal pot used for cooking over an open fire; also, a situation characterized by instability or strong emotions.",tuesday,2026-01-05,2026-01-06
21,simmer,"to stay just below the boiling point while being heated; also, to be filled with suppressed anger or excitement.",wednesday,2026-01-05,2026-01-07
22,nicety,"a fine or subtle detail, especially one that is part of polite social behavior.",wednesday,2026-01-05,2026-01-07
23,prudent,acting with or showing care and thought for the future; wise and cautious.,wednesday,2026-01-05,2026-01-07
24,indirection,the act of expressing something in a roundabout or indirect way.,wednesday,2026-01-05,2026-01-07
25,conceive,to form or devise (a plan or idea) in the mind; to imagine.,wednesday,2026-01-05,2026-01-07
26,interpose,to place or insert between one thing and another; to intervene.,wednesday,2026-01-05,2026-01-07
27,notion,"a belief, idea, or opinion.",wednesday,2026-01-05,2026-01-07
28,relic,"an object surviving from an earlier time, especially one of historical or sentimental interest.",wednesday,2026-01-05,2026-01-07
29,asocial,not enjoying or seeking the company of others; avoiding social interaction.,wednesday,2026-01-05,2026-01-07
30,adept,very skilled or proficient at something.,wednesday,2026-01-05,2026-01-07
31,taint,to contaminate or pollute something; to affect with a bad or undesirable quality.,thursday,2026-01-05,2026-01-08
32,virtue,behavior showing high moral standards; a good or desirable quality.,thursday,2026-01-05,2026-01-08
33,resent,"to feel bitter or angry about something, especially because you think it is unfair.",thursday,2026-01-05,2026-01-08
34,bungler,a person who does something clumsily or incompetently; a blunderer.,thursday,2026-01-05,2026-01-08
35,invariably,always; without exception.,thursday,2026-01-05,2026-01-08
36,feign,"to pretend to have a particular feeling, condition, or injury.",thursday,2026-01-05,2026-01-08
37,resolve,to find a solution to a problem or difficulty; to decide firmly on a course of action.,thursday,2026-01-05,2026-01-08
38,ripple,a small wave or series of waves; a feeling or effect that spreads through a group or situation.,thursday,2026-01-05,2026-01-08
39,curb,to restrain or keep in check; to control or limit something.,thursday,2026-01-05,2026-01-08
40,espouse,"to adopt or support a cause, belief, or way of life.",thursday,2026-01-05,2026-01-08
41,potent,"having great power, influence, or effect.",friday,2026-01-05,2026-01-09
42,malleable,easily influenced or changed; able to be shaped or bent.,friday,2026-01-05,2026-01-09
43,aesthetics,"the study of beauty, art, and taste; the appreciation of what is beautiful.",friday,2026-01-05,2026-01-09
44,impediment,a hindrance or obstruction in doing something; something that makes progress difficult.,friday,2026-01-05,2026-01-09
45,amoral,lacking a moral sense; not concerned with right or wrong.,friday,2026-01-05,2026-01-09
46,consume,"to use up, eat, or drink; to completely destroy or absorb.",friday,2026-01-05,2026-01-09
47,disparate,essentially different in kind; not allowing comparison.,friday,2026-01-05,2026-01-09
48,renaissance,"a revival or renewed interest in something; originally, the period of great cultural change in Europe from the 14th to 17th centuries.",friday,2026-01-05,2026-01-09
49,distillation,"the process of purifying a liquid by heating and cooling; also, the extraction of the essential meaning or most important aspects of something.",friday,2026-01-05,2026-01-09
50,premise,a statement or idea that is accepted as true and that forms the basis for a theory or argument.,friday,2026-01-05,2026-01-09
51,definitive,(of a conclusion or agreement) done or reached decisively and with authority; the most complete or reliable.,monday,2026-01-12,2026-01-12
52,pertain,to relate to or have a connection with something.,monday,2026-01-12,2026-01-12
53,pertinent,relevant or applicable to a particular matter; appropriate.,monday,2026-01-12,2026-01-12
54,foible,a minor weakness or eccentricity in someone's character.,monday,2026-01-12,2026-01-12
55,frivolous,not having any serious purpose or value; carefree and not serious.,monday,2026-01-12,2026-01-12
56,abolish,"to formally put an end to (a system, practice, or institution).",monday,2026-01-12,2026-01-12
57,inadvertently,without intention; accidentally.,monday,2026-01-12,2026-01-12
58,precarious,not securely held or in position; dangerously likely to fall or collapse; uncertain.,monday,2026-01-12,2026-01-12
59,vagaries,unexpected and inexplicable changes in a situation or in someone's behavior.,monday,2026-01-12,2026-01-12
60,vaunt,"to boast about or praise something, especially excessively.",monday,2026-01-12,2026-01-12
61,notoriously,"famous or well known, typically for some bad quality or deed.",tuesday,2026-01-12,2026-01-13
62,vanity,excessive pride in or admiration of one's own appearance or achievements.,tuesday,2026-01-12,2026-01-13
63,rancor,"bitterness or resentfulness, especially when long-standing.",tuesday,2026-01-12,2026-01-13
64,ascribe,"to attribute something to a cause, person, or source.",tuesday,2026-01-12,2026-01-13
65,surly,bad-tempered and unfriendly.,tuesday,2026-01-12,2026-01-13
66,wit,the ability to use words and ideas in a quick and inventive way to create humor; a person skilled at making clever and amusing remarks.,tuesday,2026-01-12,2026-01-13
67,obscure,not discovered or known about; uncertain; to keep from being seen; to conceal.,tuesday,2026-01-12,2026-01-13
68,odious,extremely unpleasant; repulsive; deserving of hatred.,tuesday,2026-01-12,2026-01-13
69,scruple,a feeling of doubt or hesitation with regard to the morality or propriety of a course of action.,tuesday,2026-01-12,2026-01-13
70,spiteful,"showing or caused by malice; wanting to hurt, annoy, or offend someone.",tuesday,2026-01-12,2026-01-13
71,tyrannical,exercising power in a cruel or arbitrary way.,wednesday,2026-01-12,2026-01-14
72,nunnery,a convent; a building or community where nuns live.,wednesday,2026-01-12,2026-01-14
73,intrigue,to arouse the curiosity or interest of; to make secret plans to do something illicit or harmful.,wednesday,2026-01-12,2026-01-14
74,profligate,recklessly extravagant or wasteful in the use of resources; shamelessly immoral.,wednesday,2026-01-12,2026-01-14
75,beguile,"to charm or enchant someone, sometimes in a deceptive way.",wednesday,2026-01-12,2026-01-14
76,connive,to secretly allow or be involved in wrongdoing; to conspire.,wednesday,2026-01-12,2026-01-14
77,peril,serious and immediate danger.,wednesday,2026-01-12,2026-01-14
78,bestow,to give something as an honor or present.,wednesday,2026-01-12,2026-01-14
79,avaricious,having or showing an extreme greed for wealth or material gain.,wednesday,2026-01-12,2026-01-14
80,perk,a benefit or advantage that comes with a job or situation.,wednesday,2026-01-12,2026-01-14
81,impudence,the quality of being rude and showing a lack of respect.,thursday,2026-01-12,2026-01-15
82,encumbered,restricted or burdened in such a way that free action or movement is difficult.,thursday,2026-01-12,2026-01-15
83,foment,to instigate or stir up (an undesirable or violent sentiment or course of action).,thursday,2026-01-12,2026-01-15
84,astute,having or showing an ability to accurately assess situations or people and turn this to one's advantage; shrewd.,thursday,2026-01-12,2026-01-15
85,enmity,the state or feeling of being actively opposed or hostile to someone or something.,thursday,2026-01-12,2026-01-15
86,vassal,"a person or country in a subordinate position to another; in feudal times, one who held land from a lord in return for services.",thursday,2026-01-12,2026-01-15
87,emasculate,to make someone or something weaker or less effective.,thursday,2026-01-12,2026-01-15
88,seethe,to be filled with intense but unexpressed anger; to bubble up as a result of being boiled.,thursday,2026-01-12,2026-01-15
89,chastise,to reprimand or criticize someone severely.,thursday,2026-01-12,2026-01-15
90,condescend,to show feelings of superiority; to do something in a way that shows you think it is below your dignity.,thursday,2026-01-12,2026-01-15
91,condescension,an attitude of patronizing superiority; disdain.,friday,2026-01-12,2026-01-16
92,dismay,a sudden and complete loss of courage or resolution due to an unexpected event; distress.,friday,2026-01-12,2026-01-16
93,corporal,relating to the body.,friday,2026-01-12,2026-01-16
94,confederate,"a person one works with, especially in something secret or illegal; an accomplice.",friday,2026-01-12,2026-01-16
95,venture,a risky or daring journey or undertaking; a business enterprise involving risk.,friday,2026-01-12,2026-01-16
96,ambiguous,open to more than one interpretation; not having one obvious meaning.,friday,2026-01-12,2026-01-16
97,infamous,well known for some bad quality or deed; notorious.,friday,2026-01-12,2026-01-16
98,nuance,"a subtle difference in or shade of meaning, expression, or sound.",friday,2026-01-12,2026-01-16
99,nonchalance,"the state of being calm and relaxed; not displaying anxiety, interest, or enthusiasm.",friday,2026-01-12,2026-01-16
100,blurt,to say something suddenly and without careful consideration.,friday,2026-01-12,2026-01-16
101,deluded,believing things that are not true or are based on false beliefs.,monday,2026-01-19,2026-01-19
102,coarse,having a rough or uneven texture; lacking refinement.,monday,2026-01-19,2026-01-19
103,accrue,"to gradually accumulate or increase over time, especially in terms of money or benefits.",monday,2026-01-19,2026-01-19
104,garrison,a group of soldiers stationed at a specific location to defend it.,monday,2026-01-19,2026-01-19
105,infidelity,the act of being unfaithful to a spouse or partner; cheating in a romantic relationship.,monday,2026-01-19,2026-01-19
106,ruse,a cunning plan or trick intended to deceive someone.,monday,2026-01-19,2026-01-19
107,roguish,playfully mischievous or behaving in a slightly dishonest or unprincipled way.,monday,2026-01-19,2026-01-19
108,scurry,"to move quickly and with short steps, often because one is in a hurry.",monday,2026-01-19,2026-01-19
109,allay,"to reduce the intensity of a feeling, such as fear or worry; to calm or relieve.",monday,2026-01-19,2026-01-19
110,hobnob,"to associate or mix socially, especially with people of higher status or importance.",monday,2026-01-19,2026-01-19
111,inconspicuous,not easily seen or attracting attention; blending in with the surroundings.,tuesday,2026-01-19,2026-01-20
112,emissary,"a person sent on a special mission, usually as a diplomatic representative.",tuesday,2026-01-19,2026-01-20
113,elaborate,involving many careful details or complex arrangements; to explain something in greater depth.,tuesday,2026-01-19,2026-01-20
114,bland,lacking strong features or characteristics; uninteresting or lacking flavor.,tuesday,2026-01-19,2026-01-20
115,banal,so lacking in originality as to be obvious and boring; commonplace.,tuesday,2026-01-19,2026-01-20
116,obsequious,"overly eager to please or obey someone, often in a way that is insincere.",tuesday,2026-01-19,2026-01-20
117,lull,"to make someone feel calm or less worried, sometimes so that they are less alert.",tuesday,2026-01-19,2026-01-20
118,nondescript,lacking distinctive or interesting features or characteristics; dull and unremarkable.,tuesday,2026-01-19,2026-01-20
119,conform,"to act in accordance with established customs, standards, or rules.",tuesday,2026-01-19,2026-01-20
120,jugular,relating to the veins or area in the neck.,tuesday,2026-01-19,2026-01-20
121,vague,"not clearly expressed, defined, or understood; lacking detail or certainty.",wednesday,2026-01-19,2026-01-21
122,sphinx-like,"mysterious, difficult to interpret, and not revealing emotions or thoughts.",wednesday,2026-01-19,2026-01-21
123,valor,"great courage, especially in the face of danger.",wednesday,2026-01-19,2026-01-21
124,arrogant,having an exaggerated sense of one's own importance or abilities; overly proud.,wednesday,2026-01-19,2026-01-21
125,insolent,boldly disrespectful; showing a lack of respect in speech or behavior.,wednesday,2026-01-19,2026-01-21
126,braggart,a person who boasts about achievements or possessions.,wednesday,2026-01-19,2026-01-21
127,advocate,to publicly support or recommend a particular cause or policy.,wednesday,2026-01-19,2026-01-21
128,discrepancy,a lack of agreement or consistency between two or more facts.,wednesday,2026-01-19,2026-01-21
129,grandeur,"the quality of being magnificent, impressive, or grand.",wednesday,2026-01-19,2026-01-21
130,inscrutable,impossible to understand or interpret; mysterious.,wednesday,2026-01-19,2026-01-21
131,prerogative,a right or privilege exclusive to a particular person or group.,thursday,2026-01-19,2026-01-22
132,confer,to discuss something with others to reach a decision; to grant or bestow.,thursday,2026-01-19,2026-01-22
133,enigma,a person or thing that is mysterious or difficult to understand.,thursday,2026-01-19,2026-01-22
134,insurrection,a violent uprising or organized revolt against authority or government.,thursday,2026-01-19,2026-01-22
135,eloquent,fluent or persuasive in speaking or writing; expressing ideas well.,thursday,2026-01-19,2026-01-22
136,taciturn,habitually silent or uncommunicative; reserved.,thursday,2026-01-19,2026-01-22
137,sparseness,the quality of being thinly dispersed or scattered; a small amount or number.,thursday,2026-01-19,2026-01-22
138,subvert,"to undermine, overthrow, or destroy the power or authority of a system or institution.",thursday,2026-01-19,2026-01-22
139,sheer,"used to emphasize the large amount, degree, or extent of something.",thursday,2026-01-19,2026-01-22
140,perverse,showing a deliberate and obstinate desire to behave in a way that is unreasonable or unacceptable.,thursday,2026-01-19,2026-01-22
141,providence,the protective care or guidance of a divine power; fate.,friday,2026-01-19,2026-01-23
142,unsophisticated,"lacking experience, knowledge, or refinement; simple or naive.",friday,2026-01-19,2026-01-23
143,sly,clever at deceiving people; cunning or crafty.,friday,2026-01-19,2026-01-23
144,proliferate,to increase rapidly in number or spread quickly.,friday,2026-01-19,2026-01-23
145,fraught,"filled with or destined to result in something undesirable, such as danger or difficulty.",friday,2026-01-19,2026-01-23
146,plateau,"a flat, elevated area of land; a period during which there is little or no change after progress.",friday,2026-01-19,2026-01-23
147,prerogative,a right or privilege exclusive to a person or group.,friday,2026-01-19,2026-01-23
148,oblige,to make someone legally or morally bound to do something; to do a favor.,friday,2026-01-19,2026-01-23
149,pathological,"relating to or caused by disease; behaving in an extreme, abnormal, or compulsive way.",friday,2026-01-19,2026-01-23
150,indispensable,absolutely necessary; essential.,friday,2026-01-19,2026-01-23
151,abolish,"to officially put an end to a system, practice, or institution.",monday,2026-01-26,2026-01-26
152,ingratiate,to try to gain favor or approval by doing or saying things that please others.,monday,2026-01-26,2026-01-26
153,inept,lacking skill or ability; incompetent.,monday,2026-01-26,2026-01-26
154,ostensible,"stated or appearing to be true, but not necessarily so; apparent.",monday,2026-01-26,2026-01-26
155,promenade,"a paved public walkway, especially by the sea; to take a leisurely walk.",monday,2026-01-26,2026-01-26
156,Versailles,"a royal palace near Paris, France, symbolizing absolute monarchy and opulence.",monday,2026-01-26,2026-01-26
157,countenance,"a person's facial expression; also, support or approval.",monday,2026-01-26,2026-01-26
158,precarious,"dangerously unstable, uncertain, or insecure.",monday,2026-01-26,2026-01-26
159,vagaries,unexpected and unpredictable changes or variations.,monday,2026-01-26,2026-01-26
160,ignoble,not honorable in character or purpose; morally low or base.,monday,2026-01-26,2026-01-26
161,brevity,concise and exact use of words; shortness in duration.,tuesday,2026-01-26,2026-01-27
162,succinctly,expressed in a clear and brief manner.,tuesday,2026-01-26,2026-01-27
163,ginormous,extremely large; huge.,tuesday,2026-01-26,2026-01-27
164,feign,"to pretend to have a particular feeling, condition, or injury.",tuesday,2026-01-26,2026-01-27
165,hitherto,until now; up to this time.,tuesday,2026-01-26,2026-01-27
166,inadvertently,unintentionally; without meaning to.,tuesday,2026-01-26,2026-01-27
167,conflate,"to combine two or more things into one, typically inappropriately.",tuesday,2026-01-26,2026-01-27
168,complacent,self-satisfied and unaware of possible dangers or deficiencies.,tuesday,2026-01-26,2026-01-27
169,tenacious,holding firmly to something; persistent and determined.,tuesday,2026-01-26,2026-01-27
170,unassailable,"unable to be attacked, questioned, or defeated.",tuesday,2026-01-26,2026-01-27
171,thwart,to prevent someone from accomplishing something; to oppose successfully.,wednesday,2026-01-26,2026-01-28
172,sentinel,a guard or watchman assigned to protect a place or thing.,wednesday,2026-01-26,2026-01-28
173,renown,the state of being widely known and honored; fame.,wednesday,2026-01-26,2026-01-28
174,phalanx,a large group of people or things closely packed together.,wednesday,2026-01-26,2026-01-28
175,recourse,a source of help or solution in a difficult situation.,wednesday,2026-01-26,2026-01-28
176,plummet,to fall or drop straight down at high speed.,wednesday,2026-01-26,2026-01-28
177,renege,"to go back on a promise, agreement, or commitment.",wednesday,2026-01-26,2026-01-28
178,vulgar,"lacking sophistication or good taste; coarse, rude, or offensive.",wednesday,2026-01-26,2026-01-28
179,mesmerize,to capture the complete attention of someone; to hypnotize.,wednesday,2026-01-26,2026-01-28
180,parody,"an imitation of the style of someone or something, usually for comic effect.",wednesday,2026-01-26,2026-01-28
181,solvent,having enough money to pay all debts; financially stable.,thursday,2026-01-26,2026-01-29
182,refute,to prove that a statement or theory is wrong or false.,thursday,2026-01-26,2026-01-29
183,unfathomable,impossible to understand or measure.,thursday,2026-01-26,2026-01-29
184,recess,a temporary break or pause in an activity or process.,thursday,2026-01-26,2026-01-29
185,probe,to investigate or explore deeply in order to find information.,thursday,2026-01-26,2026-01-29
186,au fait,thoroughly familiar or knowledgeable about something.,thursday,2026-01-26,2026-01-29
187,slanderous,containing or involving false and damaging statements about someone.,thursday,2026-01-26,2026-01-29
188,existing,currently present or in operation; already established.,thursday,2026-01-26,2026-01-29
189,satire,"the use of humor, irony, or ridicule to criticize or expose folly, often in society or politics.",thursday,2026-01-26,2026-01-29
190,bolster,"to support, strengthen, or improve something.",thursday,2026-01-26,2026-01-29
191,oblivion,the state of being forgotten or unknown; complete unawareness.,friday,2026-01-26,2026-01-30
192,notoriety,the state of being famous or well known for something bad.,friday,2026-01-26,2026-01-30
193,lynch,"to kill someone, usually by hanging, by a mob without a legal trial.",friday,2026-01-26,2026-01-30
194,countenance,"a person’s facial expression; also, support or approval.",friday,2026-01-26,2026-01-30
195,dwindle,to gradually become smaller or less; diminish.,friday,2026-01-26,2026-01-30
196,purported,"claimed or alleged to be true, but not proven.",friday,2026-01-26,2026-01-30
197,sober,"not affected by alcohol; serious, calm, and sensible.",friday,2026-01-26,2026-01-30
198,vantage,a position that gives a wide or advantageous view.,friday,2026-01-26,2026-01-30
199,humbug,deceptive or false talk or behavior intended to trick or mislead.,friday,2026-01-26,2026-01-30
200,eccentric,unconventional and slightly strange in behavior or appearance.,friday,2026-01-26,2026-01-30
201,enthral,to captivate someone completely; to hold their interest or attention intensely.,monday,2026-02-02,2026-02-02
202,controversy,a prolonged public disagreement or heated discussion over an issue.,monday,2026-02-02,2026-02-02
203,scandal,an action or event causing widespread public outrage or strong disapproval.,monday,2026-02-02,2026-02-02
204,sparingly,in small amounts; using or doing something with moderation or restraint.,monday,2026-02-02,2026-02-02
205,ostentatious,"displaying wealth, possessions, or power in a way that is meant to attract notice and admiration.",monday,2026-02-02,2026-02-02
206,voluptuousness,"the quality of being full-figured, curvaceous, and sexually attractive, often suggesting sensual pleasure.",monday,2026-02-02,2026-02-02
207,capricious,given to sudden and unaccountable changes of mood or behavior; unpredictable.,monday,2026-02-02,2026-02-02
208,despot,a ruler with absolute power who exercises it in a cruel or oppressive way; a tyrant.,monday,2026-02-02,2026-02-02
209,demeanour,"the outward behavior, manner, or appearance of a person.",monday,2026-02-02,2026-02-02
210,conventional,based on or in accordance with what is generally done or believed; traditional; lacking originality.,monday,2026-02-02,2026-02-02
211,titillate,"to excite or arouse someone, especially in a superficial or sexual way.",tuesday,2026-02-02,2026-02-03
212,venerate,to regard with great respect and reverence; to honor deeply.,tuesday,2026-02-02,2026-02-03
213,paltry,very small or meager; lacking in importance or value.,tuesday,2026-02-02,2026-02-03
214,primitive,"relating to the early stages of human development; simple, crude, or lacking modern conveniences.",tuesday,2026-02-02,2026-02-03
215,monumental,"extremely large, impressive, or significant.",tuesday,2026-02-02,2026-02-03
216,patent,"a legal right granted to an inventor to exclusively make, use, or sell an invention for a certain period.",tuesday,2026-02-02,2026-02-03
217,rescind,"to revoke, cancel, or repeal a law, agreement, or decision, making it no longer valid.",tuesday,2026-02-02,2026-02-03
218,divest,"to sell off, rid oneself of, or strip away rights, property, or possessions.",tuesday,2026-02-02,2026-02-03
219,impoverished,extremely poor; lacking sufficient money or resources.,tuesday,2026-02-02,2026-02-03
220,petty,of little importance; trivial; overly concerned with insignificant details.,tuesday,2026-02-02,2026-02-03
221,industrious,diligent and hardworking; constantly occupied with productive activity.,wednesday,2026-02-02,2026-02-04
222,deluge,to overwhelm with a large amount of something; a severe flood.,wednesday,2026-02-02,2026-02-04
223,prodigious,"remarkably or impressively great in size, amount, or degree.",wednesday,2026-02-02,2026-02-04
224,contemporary,a person or thing living or existing at the same time as another.,wednesday,2026-02-02,2026-02-04
225,attributable,able to be regarded as being caused by; ascribable.,wednesday,2026-02-02,2026-02-04
226,plagiarize,to copy someone else's work or ideas and present them as your own.,wednesday,2026-02-02,2026-02-04
227,slog,"to work hard and steadily over a long period, especially at something difficult or boring.",wednesday,2026-02-02,2026-02-04
228,deft,demonstrating skill and cleverness; quick and precise in movement.,wednesday,2026-02-02,2026-02-04
229,adroit,"very skillful and resourceful, especially in using the hands or mind.",wednesday,2026-02-02,2026-02-04
