id,word,meaning,day,week_start,date_sent
458,piecemeal,characterized by unsystematic partial measures taken over a period of time; not done according to a plan.,monday,2026-03-09,2026-03-09
459,stowaway,"a person who hides aboard a vehicle, such as a ship or plane, to travel secretly without paying.",monday,2026-03-09,2026-03-09
460,voyage,"a long journey, especially by sea or through space.",monday,2026-03-09,2026-03-09
461,reprieve,"an official order delaying punishment, especially a death sentence; a temporary relief from harm or discomfort.",tuesday,2026-03-09,2026-03-10
462,armada,a large fleet of warships.,tuesday,2026-03-09,2026-03-10
463,undaunted,"not discouraged or disheartened by difficulty, danger, or disappointment; still determined and enthusiastic.",tuesday,2026-03-09,2026-03-10
464,intimation,an indirect or subtle hint; the act of making something known in an indirect way.,tuesday,2026-03-09,2026-03-10
465,euphoria,a feeling or state of intense excitement and happiness.,tuesday,2026-03-09,2026-03-10
466,fruition,the point at which a plan or project is realized or completed.,tuesday,2026-03-09,2026-03-10
467,evocative,"bringing strong images, memories, or feelings to mind.",tuesday,2026-03-09,2026-03-10
468,relish,great enjoyment or delight in something.,tuesday,2026-03-09,2026-03-10
469,contingency,a future event or circumstance which is possible but cannot be predicted with certainty.,tuesday,2026-03-09,2026-03-10
470,sprezzatura,studied carelessness; the art of making difficult tasks look effortless.,tuesday,2026-03-09,2026-03-10
471,imminent,about to happen; impending.,wednesday,2026-03-09,2026-03-11
472,propensity,a natural tendency or inclination to behave in a particular way.,wednesday,2026-03-09,2026-03-11
473,mirage,an optical illusion caused by atmospheric conditions; something that appears real or possible but is not.,wednesday,2026-03-09,2026-03-11
474,spontaneous,"occurring as a result of a sudden inner impulse or inclination, without premeditation or external stimulus.",wednesday,2026-03-09,2026-03-11
475,superfluous,"unnecessary, especially because more than enough; redundant.",wednesday,2026-03-09,2026-03-11
476,profligacy,reckless extravagance or wastefulness in the use of resources.,wednesday,2026-03-09,2026-03-11
477,sumptuous,splendid and expensive-looking; luxurious.,wednesday,2026-03-09,2026-03-11
478,opulent,ostentatiously rich and luxurious or lavish.,wednesday,2026-03-09,2026-03-11
479,trifling,unimportant or trivial; insignificant.,wednesday,2026-03-09,2026-03-11
480,palatable,pleasant or acceptable to the taste or mind.,wednesday,2026-03-09,2026-03-11
481,humdrum,lacking excitement or variety; monotonous.,thursday,2026-03-09,2026-03-12
482,monotonous,"dull, tedious, and repetitious; lacking in variety and interest.",thursday,2026-03-09,2026-03-12
483,mundane,lacking interest or excitement; dull; relating to the ordinary or commonplace.,thursday,2026-03-09,2026-03-12
484,whet,to sharpen (a blade) or stimulate (one’s appetite or interest).,thursday,2026-03-09,2026-03-12
485,perpetual,never ending or changing; occurring repeatedly.,thursday,2026-03-09,2026-03-12
486,repast,a meal.,thursday,2026-03-09,2026-03-12
487,facsimile,"an exact copy, especially of written or printed material.",thursday,2026-03-09,2026-03-12
488,contrast,an obvious difference between two or more things.,thursday,2026-03-09,2026-03-12
489,lascivious,feeling or revealing an overt and offensive sexual desire.,thursday,2026-03-09,2026-03-12
490,regent,"a person appointed to administer a state because the monarch is a minor, absent, or incapacitated.",thursday,2026-03-09,2026-03-12
491,obstinate,"stubbornly refusing to change one's opinion or chosen course of action, despite attempts to persuade one to do so.",friday,2026-03-09,2026-03-13
492,volition,the power or faculty of using one's will; the act of making a conscious choice.,friday,2026-03-09,2026-03-13
493,regally,"in a way that is suitable for, or characteristic of, a king or queen; majestically.",friday,2026-03-09,2026-03-13
494,plod,"to walk or work slowly and laboriously, often with heavy steps.",friday,2026-03-09,2026-03-13
495,rectitude,morally correct behavior or thinking; righteousness.,friday,2026-03-09,2026-03-13
496,reform,"to make changes in something (typically a social, political, or economic institution or practice) in order to improve it.",friday,2026-03-09,2026-03-13
497,assuage,to make an unpleasant feeling less intense; to soothe or calm.,friday,2026-03-09,2026-03-13
498,czar,"a person appointed by government to advise on and coordinate a specific area of policy; originally, an emperor of Russia.",friday,2026-03-09,2026-03-13
499,subsidy,a sum of money granted by the government or a public body to assist an industry or business so that the price of a commodity or service may remain low or competitive.,friday,2026-03-09,2026-03-13
500,tranquil,"free from disturbance; calm, peaceful, and quiet.",friday,2026-03-09,2026-03-13
501,prig,a person who displays self-righteous moral behavior and regards themselves as superior to others.,monday,2026-03-16,2026-03-16
502,prate,to talk at length in a foolish or tedious way.,monday,2026-03-16,2026-03-16
503,tedious,"too long, slow, or boring; causing weariness or boredom.",monday,2026-03-16,2026-03-16
504,ratiocination,the process of logical and methodical reasoning.,monday,2026-03-16,2026-03-16
505,vanguard,"the forefront of an action or movement; the leading position in a movement, or the group leading an attack.",monday,2026-03-16,2026-03-16
506,bulwark,a defensive wall; something that provides strong protection or support.,monday,2026-03-16,2026-03-16
507,precipitate,to cause something to happen suddenly or sooner than expected.,monday,2026-03-16,2026-03-16
508,escapade,"an adventurous, unconventional, or risky act or incident.",monday,2026-03-16,2026-03-16
509,stultify,"to make someone or something become dull, slow, or ineffective; to prevent development or progress.",monday,2026-03-16,2026-03-16
510,skirmish,"a brief, unplanned fight, especially between small groups.",monday,2026-03-16,2026-03-16
511,trudge,"to walk slowly and with heavy steps, typically due to exhaustion or harsh conditions.",tuesday,2026-03-16,2026-03-17
512,bemoan,to express sorrow or complaint about something.,tuesday,2026-03-16,2026-03-17
513,consign,"to send or deliver something to a person or place, often officially; to assign someone to an undesirable fate or situation.",tuesday,2026-03-16,2026-03-17
514,annul,to officially declare something invalid or no longer legally binding.,tuesday,2026-03-16,2026-03-17
515,excommunication,the act of officially excluding someone from participation in the sacraments and services of a Christian church.,tuesday,2026-03-16,2026-03-17
516,mire,"to become stuck in a difficult, unpleasant, or prolonged situation.",tuesday,2026-03-16,2026-03-17
517,consolidate,"to make something stronger or more solid; to combine things into a single, unified whole.",tuesday,2026-03-16,2026-03-17
518,nay,"used to introduce a stronger or more emphatic word or phrase, typically after a previous statement.",tuesday,2026-03-16,2026-03-17
519,topsy-turvy,"in a state of confusion, disorder, or lack of organization.",tuesday,2026-03-16,2026-03-17
520,deign,"to do something that one considers to be beneath one’s dignity, often reluctantly.",tuesday,2026-03-16,2026-03-17
521,snivel,"to cry or complain in a weak, self-pitying way that fails to evoke sympathy.",wednesday,2026-03-16,2026-03-18
522,niggling,"causing slight but persistent annoyance, discomfort, or worry.",wednesday,2026-03-16,2026-03-18
523,recline,to lean or lie back in a relaxed position.,wednesday,2026-03-16,2026-03-18
524,increscent,"gradually increasing in size, amount, or intensity.",wednesday,2026-03-16,2026-03-18
525,platonic,describing a relationship that is affectionate and close but not sexual.,wednesday,2026-03-16,2026-03-18
526,bevy,"a large group or collection, typically of people or things.",wednesday,2026-03-16,2026-03-18
527,insignia,"a badge or distinguishing mark of rank, office, or membership.",wednesday,2026-03-16,2026-03-18
528,pastime,an activity that is done for enjoyment rather than work; a hobby.,wednesday,2026-03-16,2026-03-18
529,chastity,"the practice of refraining from extramarital, or especially from all, sexual intercourse.",wednesday,2026-03-16,2026-03-18
530,gestalt,an organized whole that is perceived as more than the sum of its parts.,wednesday,2026-03-16,2026-03-18
531,primacy,the state of being first in importance; preeminence.,thursday,2026-03-16,2026-03-19
532,tout,to attempt to sell or promote something persistently or aggressively.,thursday,2026-03-16,2026-03-19
533,peddling,"the act of selling goods, often of questionable legality or value, especially door-to-door or illegally.",thursday,2026-03-16,2026-03-19
534,disgruntled,"dissatisfied, annoyed, or discontented.",thursday,2026-03-16,2026-03-19
535,sedulous,showing persistent and careful effort; diligent.,thursday,2026-03-16,2026-03-19
536,censure,to express strong formal disapproval of someone or something.,thursday,2026-03-16,2026-03-19
537,aegis,"protection, backing, or support of a particular person or organization.",thursday,2026-03-16,2026-03-19
538,expedition,"a journey or voyage undertaken for a specific purpose, often by a group with a common goal.",thursday,2026-03-16,2026-03-19
539,exuberance,"the quality of being full of energy, excitement, and cheerfulness.",thursday,2026-03-16,2026-03-19
540,flamboyance,"the tendency to attract attention because of exuberance, confidence, or stylishness.",thursday,2026-03-16,2026-03-19
541,quell,"to put an end to, suppress, or subdue, especially by force.",friday,2026-03-16,2026-03-20
542,indulge,to allow oneself or someone else to enjoy a pleasure or desire.,friday,2026-03-16,2026-03-20
543,impious,lacking respect or reverence for God or religion.,friday,2026-03-16,2026-03-20
544,heresy,a belief or opinion that goes against orthodox religious doctrine.,friday,2026-03-16,2026-03-20
545,stale,no longer fresh or new; lacking in originality or effectiveness.,friday,2026-03-16,2026-03-20
546,convoluted,"extremely complex, intricate, or difficult to follow.",friday,2026-03-16,2026-03-20
547,disavow,to deny responsibility for or connection with something; to reject.,friday,2026-03-16,2026-03-20
548,ostracism,"exclusion from a society, group, or social acceptance.",friday,2026-03-16,2026-03-20
549,derogatory,"showing a critical, disrespectful, or disparaging attitude.",friday,2026-03-16,2026-03-20
550,assiduous,"showing great care, attention, and perseverance.",friday,2026-03-16,2026-03-20
551,ferret,to search for something persistently and thoroughly.,monday,2026-03-23,2026-03-23
552,dissimulation,"the act of hiding one's thoughts, feelings, or character; pretense.",monday,2026-03-23,2026-03-23
553,belligerently,"in a hostile, aggressive, or warlike manner.",monday,2026-03-23,2026-03-23
554,tirade,"a long, angry, and critical speech.",monday,2026-03-23,2026-03-23
555,goad,to provoke or annoy someone so as to stimulate a reaction.,monday,2026-03-23,2026-03-23
556,invective,"insulting, abusive, or highly critical language.",monday,2026-03-23,2026-03-23
557,petulance,"the quality of being childishly sulky, irritable, or easily annoyed.",monday,2026-03-23,2026-03-23
558,shabby,in poor condition through long use or lack of care.,monday,2026-03-23,2026-03-23
559,vicious,"deliberately cruel, violent, or dangerous.",monday,2026-03-23,2026-03-23
560,insatiable,impossible to satisfy; always wanting more.,monday,2026-03-23,2026-03-23
561,implausible,not seeming reasonable or probable; difficult to believe.,tuesday,2026-03-23,2026-03-24
562,resplendent,"shining brilliantly; very bright, attractive, or impressive in appearance.",tuesday,2026-03-23,2026-03-24
563,emaciated,"extremely thin and weak, often due to illness or lack of food.",tuesday,2026-03-23,2026-03-24
564,litigation,the process of taking legal action; resolving disputes in court.,tuesday,2026-03-23,2026-03-24
565,contortion,"a twisted or bent condition, shape, or form.",tuesday,2026-03-23,2026-03-24
566,alienated,feeling isolated or estranged from others or from a group.,tuesday,2026-03-23,2026-03-24
567,consummate,showing a high degree of skill or perfection; highly accomplished.,tuesday,2026-03-23,2026-03-24
568,regaling,"entertaining or amusing someone, often with food, drink, or stories.",tuesday,2026-03-23,2026-03-24
569,servility,an excessive willingness to serve or please others; submissiveness.,tuesday,2026-03-23,2026-03-24
570,requite,"to return a favor, service, or feeling.",tuesday,2026-03-23,2026-03-24
571,ignoramus,an ignorant or uneducated person.,wednesday,2026-03-23,2026-03-25
572,reproach,"to express disapproval, disappointment, or criticism.",wednesday,2026-03-23,2026-03-25
573,remonstrate,to make a forceful or earnest protest or objection.,wednesday,2026-03-23,2026-03-25
574,vice,immoral or wicked behavior; a bad habit.,wednesday,2026-03-23,2026-03-25
575,facile,appearing neat and comprehensive only by ignoring the true complexities of an issue; superficial.,wednesday,2026-03-23,2026-03-25
576,reinvigorate,"to give new energy, strength, or life to something or someone.",wednesday,2026-03-23,2026-03-25
577,debauchery,"excessive indulgence in sensual pleasures, especially involving sex, alcohol, or drugs.",wednesday,2026-03-23,2026-03-25
578,inertia,a tendency to remain unchanged or do nothing; resistance to change or motion.,wednesday,2026-03-23,2026-03-25
579,denigrate,to unfairly criticize or belittle someone or something.,wednesday,2026-03-23,2026-03-25
580,elude,"to escape from or avoid something or someone, typically in a skillful or cunning way.",wednesday,2026-03-23,2026-03-25
581,pugnacity,a natural disposition to be aggressive or eager to fight or argue.,thursday,2026-03-23,2026-03-26
582,rudimentary,involving only basic principles; elementary or undeveloped.,thursday,2026-03-23,2026-03-26
583,crudity,"the quality of being rudimentary, coarse, or lacking refinement.",thursday,2026-03-23,2026-03-26
584,odyssey,"a long, adventurous journey or experience.",thursday,2026-03-23,2026-03-26
585,surmise,to suppose something is true without having evidence to confirm it.,thursday,2026-03-23,2026-03-26
586,presumptuous,failing to observe the limits of what is permitted or appropriate; overconfident.,thursday,2026-03-23,2026-03-26
587,ambivalent,having mixed or contradictory feelings about something or someone.,thursday,2026-03-23,2026-03-26
588,austerity,extreme plainness and simplicity; strict economic measures to reduce spending.,thursday,2026-03-23,2026-03-26
589,sternness,"the quality of being serious, strict, or severe.",thursday,2026-03-23,2026-03-26
590,plenitude,an abundance or large amount of something.,thursday,2026-03-23,2026-03-26
591,prosperity,"the state of being successful, especially financially.",friday,2026-03-23,2026-03-27
592,cohesion,"the action or fact of forming a united, integrated whole.",friday,2026-03-23,2026-03-27
593,dissension,disagreement that leads to discord within a group.,friday,2026-03-23,2026-03-27
594,discord,lack of agreement or harmony between people.,friday,2026-03-23,2026-03-27
595,ostracise,to exclude someone from a society or group.,friday,2026-03-23,2026-03-27
596,overweening,"showing excessive confidence, pride, or arrogance.",friday,2026-03-23,2026-03-27
597,incessant,continuing without interruption; unceasing.,friday,2026-03-23,2026-03-27
598,ardent,"very enthusiastic, passionate, or fervent.",friday,2026-03-23,2026-03-27
599,precept,a general rule or principle intended to regulate behavior or thought.,friday,2026-03-23,2026-03-27
600,resolute,"admirably purposeful, determined, and unwavering.",friday,2026-03-23,2026-03-27
601,rally,"to come together and recover strength, spirit, or position after a setback or defeat.",monday,2026-03-30,2026-03-30
602,milieu,a person's social or cultural environment and surroundings.,monday,2026-03-30,2026-03-30
603,prelude,an action or event that serves as an introduction to something more important.,monday,2026-03-30,2026-03-30
604,whittle,to shape or reduce something by cutting small slices or pieces from it.,monday,2026-03-30,2026-03-30
605,coiffeur,"a male hairdresser, especially one who styles women's hair.",monday,2026-03-30,2026-03-30
606,whim,"a sudden or impulsive idea, desire, or change of mind.",monday,2026-03-30,2026-03-30
607,deficit,the amount by which spending exceeds income or receipts; a shortfall.,monday,2026-03-30,2026-03-30
608,teeter,to move or balance unsteadily; to be on the verge of falling.,monday,2026-03-30,2026-03-30
609,epiphany,"a sudden, intuitive insight or realization about something important.",monday,2026-03-30,2026-03-30
610,blatant,"completely obvious, conspicuous, and done unashamedly, often in an offensive way.",monday,2026-03-30,2026-03-30
611,protrude,to extend beyond or stick out from a surface.,tuesday,2026-03-30,2026-03-31
612,requisite,required or necessary for a particular purpose.,tuesday,2026-03-30,2026-03-31
613,wherewithal,"the means, especially money or resources, needed to accomplish something.",tuesday,2026-03-30,2026-03-31
614,egregious,outstandingly bad or shocking.,tuesday,2026-03-30,2026-03-31
615,sobriety,the state of being sober; not affected by alcohol; seriousness or self-restraint.,tuesday,2026-03-30,2026-03-31
616,vie,to compete eagerly with others for something.,tuesday,2026-03-30,2026-03-31
617,boisterous,"noisy, energetic, and cheerful; rowdy.",tuesday,2026-03-30,2026-03-31
618,harangue,a lengthy and aggressive speech.,tuesday,2026-03-30,2026-03-31
619,caricature,a portrayal or imitation of someone that exaggerates certain features for comic or grotesque effect.,tuesday,2026-03-30,2026-03-31
620,intractable,"hard to control, manage, or solve.",tuesday,2026-03-30,2026-03-31
621,reef,"a ridge of rocks, sand, or coral near the surface of the water; a hazardous underwater obstruction.",wednesday,2026-03-30,2026-04-01
622,abstract,existing as an idea or quality rather than as something concrete; not having physical existence.,wednesday,2026-03-30,2026-04-01
623,succour,assistance or aid given to someone in need or distress.,wednesday,2026-03-30,2026-04-01
624,fraternity,"a group of people sharing a common profession, interest, or purpose; brotherhood.",wednesday,2026-03-30,2026-04-01
625,flout,"to openly disregard, mock, or show contempt for rules or conventions.",wednesday,2026-03-30,2026-04-01
626,enact,to make into law or put into practice.,wednesday,2026-03-30,2026-04-01
627,zeitgeist,"the defining spirit, mood, or ideas characteristic of a particular period in history.",wednesday,2026-03-30,2026-04-01
628,stagnation,"a state of not moving, developing, or advancing; inactivity.",wednesday,2026-03-30,2026-04-01
629,dizzy,feeling as if one might fall or lose balance; lightheaded or faint.,wednesday,2026-03-30,2026-04-01
630,sputter,to make a series of soft explosive or spitting sounds; to speak or proceed in a confused or excited way.,wednesday,2026-03-30,2026-04-01
631,bleak,"cold, miserable, and lacking in hope; gloomy or depressing.",thursday,2026-03-30,2026-04-02
632,elect,to choose or decide to do something; to select by vote or decision.,thursday,2026-03-30,2026-04-02
633,farce,"an absurd event or situation, often characterized by ridiculous or improbable happenings.",thursday,2026-03-30,2026-04-02
634,absurd,"wildly unreasonable, illogical, or inappropriate.",thursday,2026-03-30,2026-04-02
635,bludgeon,to hit someone repeatedly with a heavy object or weapon.,thursday,2026-03-30,2026-04-02
636,brooding,"deeply or seriously thinking about something that makes one sad, worried, or angry.",thursday,2026-03-30,2026-04-02
637,commiserate,to express or feel sympathy or pity for someone else's misfortune.,thursday,2026-03-30,2026-04-02
638,posthumously,"occurring, awarded, or appearing after the death of the originator.",thursday,2026-03-30,2026-04-02
639,guild,"an organized group of people with the same profession, trade, or interests.",thursday,2026-03-30,2026-04-02
640,tacit,understood or implied without being stated openly.,thursday,2026-03-30,2026-04-02
641,ornate,elaborately or highly decorated.,friday,2026-03-30,2026-04-03
642,forestall,to prevent or obstruct something by taking action ahead of time.,friday,2026-03-30,2026-04-03
643,elicit,"to draw out or evoke a response, answer, or fact from someone.",friday,2026-03-30,2026-04-03
644,magnanimity,"generosity or kindness, especially towards a rival or someone you have defeated.",friday,2026-03-30,2026-04-03
645,laud,"to praise highly, especially in public.",friday,2026-03-30,2026-04-03
646,liaison,communication or cooperation that facilitates a close working relationship between people or organizations.,friday,2026-03-30,2026-04-03
647,hurtle,"to move or cause to move at a great speed, typically in an uncontrolled manner.",friday,2026-03-30,2026-04-03
648,modus operandi,a particular way or method of doing something; a characteristic method.,friday,2026-03-30,2026-04-03
649,modus vivendi,an arrangement or agreement allowing conflicting parties to coexist peacefully.,friday,2026-03-30,2026-04-03
650,subordinate,lower in rank or position; of less importance.,friday,2026-03-30,2026-04-03
651,horde,"a large group or crowd, typically in a somewhat unruly fashion.",monday,2026-04-06,2026-04-06
652,infantry,soldiers who fight on foot.,monday,2026-04-06,2026-04-06
653,barbarous,"extremely cruel, brutal, or primitive.",monday,2026-04-06,2026-04-06
654,flux,continuous movement or change; instability.,monday,2026-04-06,2026-04-06
655,stasis,a state of inactivity or equilibrium where there is little or no change.,monday,2026-04-06,2026-04-06
656,congeal,to change from a fluid or soft state to a solid or rigid state; to thicken or solidify.,monday,2026-04-06,2026-04-06
657,inhibition,a feeling or restraint that prevents someone from expressing themselves freely or acting naturally.,monday,2026-04-06,2026-04-06
658,libidinal,relating to sexual drive or desire.,monday,2026-04-06,2026-04-06
659,motility,the ability to move spontaneously and actively.,monday,2026-04-06,2026-04-06
660,decimate,"to destroy, kill, or remove a large proportion of something.",monday,2026-04-06,2026-04-06
661,erode,"to gradually wear away, deteriorate, or be destroyed.",tuesday,2026-04-06,2026-04-07
662,cadaver,"a dead human body, often used for scientific or medical study.",tuesday,2026-04-06,2026-04-07
663,foist,to force someone to accept something unwanted or unwelcome.,tuesday,2026-04-06,2026-04-07
664,barb,"a sharp, cutting remark intended to hurt or criticize.",tuesday,2026-04-06,2026-04-07
665,veer,to change direction suddenly.,tuesday,2026-04-06,2026-04-07
666,Capone,"a reference to Al Capone, an infamous American gangster; can refer more generally to a mobster or criminal.",tuesday,2026-04-06,2026-04-07
667,slew,a violent or uncontrolled sliding movement; a large number or quantity of something.,tuesday,2026-04-06,2026-04-07
668,squelch,"to suppress, silence, or crush completely.",tuesday,2026-04-06,2026-04-07
669,permeate,to spread or diffuse throughout something.,tuesday,2026-04-06,2026-04-07
670,pervade,to be present and apparent throughout; to spread through all parts of something.,tuesday,2026-04-06,2026-04-07
671,scrutiny,close and critical examination or observation.,wednesday,2026-04-06,2026-04-08
672,deliberate,"done consciously and intentionally; also, long and careful consideration.",wednesday,2026-04-06,2026-04-08
673,run amok,to behave uncontrollably and disruptively.,wednesday,2026-04-06,2026-04-08
674,introspection,the examination or observation of one's own mental and emotional processes.,wednesday,2026-04-06,2026-04-08
675,bias,"prejudice in favor of or against one thing, person, or group compared with another, usually in a way considered unfair.",wednesday,2026-04-06,2026-04-08
676,trot,"to run at a moderate, steady pace (especially used for horses).",wednesday,2026-04-06,2026-04-08
677,culminate,"to reach the highest point, climax, or a decisive moment.",wednesday,2026-04-06,2026-04-08
678,limbic,"relating to the limbic system of the brain, which deals with emotions and memory.",wednesday,2026-04-06,2026-04-08
679,grandiose,"excessively grand, ambitious, or impressive, often to the point of being unrealistic or pretentious.",wednesday,2026-04-06,2026-04-08
680,inveterate,"having a particular habit, activity, or interest that is long-established and unlikely to change.",wednesday,2026-04-06,2026-04-08
681,exhilarating,"making one feel very happy, animated, or elated.",thursday,2026-04-06,2026-04-09
682,inoculate,to introduce a substance into the body to produce immunity to a disease; to build resistance.,thursday,2026-04-06,2026-04-09
683,skeptical,not easily convinced; having doubts or reservations.,thursday,2026-04-06,2026-04-09
684,demagogue,a political leader who seeks support by appealing to popular desires and prejudices rather than rational argument.,thursday,2026-04-06,2026-04-09
685,manic,"showing wild, hectic, or frenzied activity or excitement.",thursday,2026-04-06,2026-04-09
686,empathy,the ability to understand and share another person's feelings or experiences.,thursday,2026-04-06,2026-04-09
687,fleeting,lasting for a very short time; passing quickly.,thursday,2026-04-06,2026-04-09
688,accentuate,to make something more noticeable or prominent.,thursday,2026-04-06,2026-04-09
689,vivacious,"attractively lively, animated, and enthusiastic.",thursday,2026-04-06,2026-04-09
690,erratic,not even or regular in pattern or movement; unpredictable.,thursday,2026-04-06,2026-04-09
